"Title","Author.Creator","Year","Region","to_annotate","annotation_characters","annotation_settings","annotation_events","score_characters","score_events","score_settings","fictionility"
"Gargantua","Rabelais",1534,"France","Gargantua by Rabelais written in 1534","""Gargantua"" by François Rabelais is a satirical and comedic work that features the character Gargantua, a giant. In the context of the 16th century, the existence of giants like Gargantua would have been considered improbable. While folklore and myth often included giants, they were not believed to be real by the educated classes of the time. The character of Gargantua is a product of Rabelais' imagination, serving as a vehicle for satire and social commentary. Given the historical context and the nature of the character, Gargantua's existence would not have been considered possible, as it requires a soft violation of the laws of the real world, such as the existence of giants. Therefore, the character of Gargantua would be evaluated as an invented character whose existence is not possible because it requires few or soft violations of the laws of the real world. Score=4","""Gargantua"" by François Rabelais is a satirical and fantastical work that features a mix of real and invented locations. The narrative includes references to actual places in France, such as Paris and the Loire Valley, which are depicted with exaggerated and humorous details. However, the work also introduces entirely fictional locations, such as the Abbey of Thélème, which embodies Rabelais' utopian ideals and satirical commentary on monastic life. 

Considering the worldview and beliefs of people in the 16th century, the existence of such a utopian abbey would be improbable, as it defies the social and religious norms of the time. However, it does not require extreme violations of the laws of the real world, as it is more a social and cultural satire than a fantastical impossibility. Therefore, the invented locations in ""Gargantua"" are not possible in the context of the period, but they do not involve frequent or extreme violations of natural laws.

Score=4","""Gargantua"" by François Rabelais is a satirical and comedic work that features the life and adventures of the giant Gargantua. The events in the book are highly exaggerated and fantastical, reflecting the Renaissance period's penchant for blending humor with social commentary. The narrative includes events such as Gargantua's miraculous birth, his prodigious appetite, and his extraordinary feats of strength and intellect. These events are clearly invented and are not grounded in historical reality. 

Considering the worldview and beliefs of people in the 16th century, while there was a fascination with giants and mythical creatures, the specific events described in ""Gargantua"" would have been recognized as fictional and humorous exaggerations rather than probable historical occurrences. The events require frequent and extreme violations of the laws of the real world, such as the existence of giants and their implausible actions.

Therefore, based on the scale provided, the events in ""Gargantua"" are best categorized as invented historical events whose occurrence is not possible because they require frequent or extreme violations of the laws of the real world.

Score=5",4,5,4,13
"The Canterbury Tales","Geoffrey Chaucer",1400,"England","The Canterbury Tales by Geoffrey Chaucer written in 1400","""The Canterbury Tales"" by Geoffrey Chaucer is a collection of stories told by a group of pilgrims traveling to Canterbury. The main protagonists are the pilgrims themselves, who are depicted as a diverse group of individuals from various walks of life, such as the Knight, the Miller, the Wife of Bath, and the Pardoner, among others. These characters are fictional, but they are crafted to represent real social types and classes of 14th-century England. Chaucer's characters are not based on specific historical figures, but they are plausible representations of people who could have existed during that time. Therefore, they are invented characters whose existence is probable, as they reflect the social realities and personalities of the period. Score=2","""The Canterbury Tales"" by Geoffrey Chaucer is set in real geographical locations that were known and documented to exist during the time it was written. The primary setting is the pilgrimage route from London to Canterbury, specifically to the shrine of Saint Thomas Becket at Canterbury Cathedral. This was a well-known and frequently traveled route in medieval England. Chaucer's descriptions of the journey and the places along the way, such as the Tabard Inn in Southwark, are based on real locations that would have been familiar to his contemporary audience. Therefore, the work does not involve invented locations or require any violations of the laws of the real world according to the beliefs and worldview of people in the 14th century. Score=0","""The Canterbury Tales"" by Geoffrey Chaucer is a collection of stories told by a group of pilgrims traveling to the shrine of Saint Thomas Becket in Canterbury. The tales themselves are fictional, but they are set within the context of a real pilgrimage, which was a common practice in medieval England. The stories range from moral fables to bawdy tales, and while they are fictional, they reflect the social, religious, and cultural milieu of the 14th century.

The pilgrimage itself, as a framework for the tales, is an actual historical event with invented details. Pilgrimages to Canterbury were indeed common during this period, and Chaucer uses this real-life practice as a backdrop for his fictional narratives. The individual tales, however, are largely invented and serve as a vehicle for Chaucer's commentary on various aspects of medieval society.

Given that the pilgrimage is a real event with fictional embellishments and the tales themselves are fictional but plausible within the context of the time, the work can be evaluated as actual historical events with invented details.

Score=1",2,1,0,3
"Faust","Johann Wolfgang von Goethe",1808,"Germany","Faust by Johann Wolfgang von Goethe written in 1808","In Goethe's ""Faust,"" the main protagonist, Dr. Faust, is a character based on the historical figure Johann Georg Faust, a German alchemist, astrologer, and magician who lived in the early 16th century. However, Goethe's portrayal of Faust includes significant fictional elements, particularly his pact with Mephistopheles, a demon. While the historical Faust was a real person, the details of his life in Goethe's work are largely invented, and the supernatural aspects of his character, such as making a deal with the devil, are not probable within the worldview of the early 19th century. During this period, belief in the supernatural was more common, but the specific narrative of Faust's pact and the extent of his interactions with Mephistopheles would have been seen as fictional. Therefore, the character of Faust in Goethe's work can be classified as a real character with invented biographical details. Score=1","In ""Faust"" by Johann Wolfgang von Goethe, the settings primarily include real geographical locations with some invented details. The story is set in Germany, with specific references to places like Leipzig and the Harz Mountains, which are real and known to exist. However, the work also includes fantastical elements, such as the Walpurgis Night scene, which takes place on the Brocken, a real mountain, but involves supernatural occurrences and mythical beings. During the early 19th century, when Goethe wrote ""Faust,"" the belief in supernatural elements and mythical locations was more prevalent, and such settings would have been seen as imaginative but not entirely impossible. Therefore, the settings in ""Faust"" can be categorized as real locations with invented details, reflecting the worldview of the time. Score=1","""Faust"" by Johann Wolfgang von Goethe is a dramatic work that revolves around the character of Faust, who makes a pact with the devil, Mephistopheles, in exchange for unlimited knowledge and worldly pleasures. The central events of the story, such as the pact with the devil and the subsequent supernatural occurrences, are rooted in folklore and myth rather than historical fact.

In the context of the early 19th century, when Goethe wrote ""Faust,"" the belief in the supernatural, including the existence of the devil and the possibility of making pacts with such entities, was more prevalent than it is today. However, even within that historical context, these events would be considered fictional and not probable. The narrative involves supernatural elements that require violations of the natural laws as understood at the time, such as the devil's ability to manipulate reality and grant extraordinary powers.

Therefore, the events in ""Faust"" are invented and involve occurrences that are not possible, requiring frequent or extreme violations of the laws of the real world, even by the standards of the early 19th century. 

Score=5",1,5,1,7
"The Rubaiyat of Omar Khayyam","Omar Khayyam",1120,"Persia","The Rubaiyat of Omar Khayyam by Omar Khayyam written in 1120","""The Rubaiyat of Omar Khayyam"" is a collection of quatrains attributed to Omar Khayyam, a Persian polymath who lived from 1048 to 1131. Omar Khayyam is a real historical figure, known for his contributions to mathematics, astronomy, and poetry. The work itself is a series of philosophical and existential reflections, often personified through a poetic voice that contemplates life, fate, and the universe. The main protagonist, if one can be identified, is essentially the poetic voice or persona of Omar Khayyam himself, reflecting his thoughts and worldview.

Given that Omar Khayyam is a documented historical figure, the main protagonist of the work is based on a real person. Therefore, the degree of invention in terms of character is minimal, as the work reflects the thoughts and philosophical musings of a real individual known to have existed.

Score=0","""The Rubaiyat of Omar Khayyam"" is a collection of quatrains attributed to the Persian polymath Omar Khayyam. The work is primarily philosophical and poetic, focusing on themes such as the nature of life, the passage of time, and the pursuit of happiness. The settings in the Rubaiyat are generally reflective of the real geographical and cultural context of 11th-12th century Persia (modern-day Iran). The references to gardens, wine, and the natural world are consistent with the real environment and cultural practices of the time. There are no invented locations that require violations of the laws of the real world. Therefore, the settings can be considered real geographical locations with no significant invented details. 

Score=0","""The Rubaiyat of Omar Khayyam"" is a collection of quatrains (four-line poems) attributed to the Persian polymath Omar Khayyam. The work is primarily philosophical and poetic, focusing on themes such as the nature of life, the passage of time, and the pursuit of happiness. It does not aim to recount historical events but rather to explore existential and metaphysical ideas.

Given the nature of the work, it does not contain historical events, invented or otherwise. Instead, it presents reflections and musings on life and existence. Therefore, it is not applicable to evaluate it on the scale provided, as the work does not engage with historical events in any form.

Score=NA",0,NA,0,NA
"War and Peace","Leo Tolstoy",1869,"Russia","War and Peace by Leo Tolstoy written in 1869","""War and Peace"" by Leo Tolstoy is a historical novel set during the Napoleonic Wars, primarily focusing on the lives of Russian aristocrats. The main protagonists, such as Pierre Bezukhov, Prince Andrei Bolkonsky, and Natasha Rostova, are fictional characters. However, they are crafted with a high degree of realism and are representative of the Russian nobility of the time. Their existence is probable within the historical context of early 19th-century Russia, as they embody the social, cultural, and personal dynamics of that era. Tolstoy's characters are not based on specific historical figures, but they are plausible within the setting he describes. Therefore, according to the scale, these characters would be classified as invented characters whose existence is probable. Score=2","""War and Peace"" by Leo Tolstoy is set in real geographical locations, primarily in Russia and parts of Europe, during the Napoleonic Wars. The novel meticulously describes cities like Moscow and St. Petersburg, as well as various battlefields and estates, all of which are real and documented to exist. Tolstoy's detailed depiction of these settings aligns with the historical and geographical knowledge of the 19th century. There are no invented locations in the novel; instead, Tolstoy uses real places to ground his narrative in the historical context of the time. Therefore, based on the specified referent, the work should be evaluated as follows: Score=0.","""War and Peace"" by Leo Tolstoy is a historical novel set during the Napoleonic Wars, specifically focusing on the French invasion of Russia. The novel incorporates actual historical events, such as the Battle of Borodino and the French retreat from Moscow, and includes real historical figures like Napoleon Bonaparte and Tsar Alexander I. Tolstoy meticulously researched these events and figures, aiming to provide an accurate depiction of the period.

However, while the major historical events are accurately portrayed, Tolstoy adds invented details and personal stories to enhance the narrative and explore philosophical themes. These invented details are woven into the fabric of real historical events, making them plausible within the context of the time.

Considering the criteria, the work primarily consists of actual historical events with invented details, aligning with the worldview and beliefs of people in the historical period depicted. Therefore, the appropriate score for ""War and Peace"" is:

Score=1",2,1,NA,NA
"The Iliad","Homer",-800,"Greece","The Iliad by Homer written in -800","The main protagonists of ""The Iliad"" by Homer include characters such as Achilles, Hector, and Agamemnon. These characters are based on figures from Greek mythology and the legendary Trojan War. In the historical period of the work, the ancient Greeks believed in the existence of these characters as part of their mytho-historical tradition. While there may have been some historical basis for the Trojan War, the specific characters and their detailed stories in ""The Iliad"" are largely mythological and not documented as real historical figures. Therefore, they are invented characters whose existence is not probable, as they are part of a mythological narrative rather than a historical account. 

Score=3","The Iliad by Homer is an ancient Greek epic poem that primarily takes place in and around the city of Troy, known in the historical context as Ilion or Ilium. The setting includes real geographical locations such as Troy itself, the Aegean Sea, and various Greek city-states like Mycenae and Sparta. These locations were known to the ancient Greeks and are documented to have existed, although the specific details of the Trojan War and the exact nature of Troy as described in the poem involve some legendary embellishments. However, the geographical settings themselves are based on real places known to the people of that time. Therefore, according to the worldview and beliefs of people in the historical period of the work, the settings are real geographical locations with some invented details. Score=1","The Iliad by Homer is an epic poem that recounts events during the Trojan War, a conflict between the Greeks (Achaeans) and the city of Troy. While the existence of a city like Troy and conflicts in the region are supported by some archaeological evidence, the specific events described in The Iliad, such as the involvement of gods in human affairs and the detailed accounts of battles and heroes, are largely mythological. 

In the context of the worldview and beliefs of people in the historical period when The Iliad was composed, the intervention of gods and the heroic feats described might have been considered plausible. However, from a historical perspective, these events are not documented or verified as actual occurrences. Therefore, they are invented historical events whose occurrence is not probable, given the mythological elements and lack of concrete historical evidence.

Score=3",3,3,1,7
"The Lord of the Rings (series)","J.R.R. Tolkien",1954,"United Kingdom","The Lord of the Rings (series) by J.R.R. Tolkien written in 1954","""The Lord of the Rings"" series by J.R.R. Tolkien features a range of characters that are entirely invented and exist within a fictional universe. The main protagonists include hobbits, elves, dwarves, wizards, and other fantastical beings. These characters are not based on real historical figures, nor do they exist within the realm of probable human experience. The existence of such characters requires frequent and extreme violations of the laws of the real world, such as the presence of magic, mythical creatures, and otherworldly powers. Given the worldview and beliefs of people in the mid-20th century, when the work was written, these characters are clearly understood as fictional and impossible in the real world. Therefore, the characters fall into the category of invented characters whose existence is not possible due to frequent or extreme violations of the laws of the real world. Score=5","""The Lord of the Rings"" series by J.R.R. Tolkien is set in the fictional world of Middle-earth, which is a fully invented location. Tolkien, a philologist and scholar, created an elaborate and detailed world with its own geography, languages, and history. Middle-earth is not based on any real geographical locations, although it draws inspiration from various mythologies and ancient cultures. The existence of Middle-earth requires frequent and extreme violations of the laws of the real world, such as the presence of magical beings, mythical creatures, and enchanted landscapes. Given the historical period of the work (mid-20th century), the worldview and beliefs of people at that time would not support the existence of such a fantastical world. Therefore, the setting of ""The Lord of the Rings"" would be evaluated as an invented location whose existence is not possible due to frequent or extreme violations of the laws of the real world. Score=5","""The Lord of the Rings"" series by J.R.R. Tolkien is a high fantasy work set in the fictional world of Middle-earth. The events described in the series, such as the journey to destroy the One Ring, the battles involving various races like elves, dwarves, and orcs, and the presence of magical beings like wizards and talking trees, are entirely invented. These events require frequent and extreme violations of the laws of the real world, such as the existence of magic, mythical creatures, and a completely fictional history and geography. While Tolkien's work is deeply inspired by mythology, language, and ancient literature, the events themselves are not grounded in any historical reality or probability, even by the standards of the mid-20th century when the books were written. Therefore, the series falls into the category of events that are not possible due to frequent or extreme violations of the laws of the real world. Score=5",5,5,5,15
"Alice's Adventures in Wonderland","Lewis Carroll",1865,"United Kingdom","Alice's Adventures in Wonderland by Lewis Carroll written in 1865","Alice's Adventures in Wonderland by Lewis Carroll features a young girl named Alice as the main protagonist. Alice is an invented character, but her existence is probable within the context of the 19th century, as she is portrayed as a typical child of that era. However, the other main characters she interacts with, such as the White Rabbit, the Cheshire Cat, the Mad Hatter, and the Queen of Hearts, are anthropomorphic animals and fantastical beings. These characters require frequent or extreme violations of the laws of the real world, such as talking animals and magical occurrences, which are not possible according to the worldview and beliefs of people in the 19th century. Therefore, the main protagonists, excluding Alice, fall into the category of invented characters whose existence is not possible due to these violations. Score=5","Alice's Adventures in Wonderland by Lewis Carroll is a classic work of literature that features a fantastical setting known as Wonderland. This setting is characterized by its whimsical and surreal nature, with locations such as the Mad Hatter's tea party, the Queen of Hearts' garden, and the Cheshire Cat's tree. These places are not based on real geographical locations and are filled with elements that defy the laws of the real world, such as talking animals, size-altering potions, and disappearing cats. 

Considering the historical period of the mid-19th century, the worldview and beliefs of people at that time would not support the existence of such fantastical elements as plausible. The setting of Wonderland requires frequent and extreme violations of the laws of the real world, such as gravity, logic, and biology. Therefore, the setting of Alice's Adventures in Wonderland is best categorized as an invented location whose existence is not possible due to these frequent and extreme violations.

Score=5","""Alice's Adventures in Wonderland"" by Lewis Carroll is a classic example of literary nonsense and fantasy. The events in the story include Alice shrinking and growing after consuming various substances, talking animals, and playing croquet with living flamingos and hedgehogs. These events are not grounded in historical reality and involve frequent and extreme violations of the laws of the real world, such as the laws of physics and biology. 

Considering the worldview and beliefs of people in the historical period of the work, the Victorian era, these events would have been seen as purely fantastical and impossible. The story is intended to entertain and explore the absurd, rather than to depict any probable or possible historical events. 

Score=5",5,5,5,15
"The Hitchhiker's Guide to the Galaxy","Douglas Adams",1979,"United Kingdom","The Hitchhiker's Guide to the Galaxy by Douglas Adams written in 1979","""The Hitchhiker's Guide to the Galaxy"" by Douglas Adams is a science fiction novel featuring a variety of characters that are largely invented and require significant suspension of disbelief regarding their existence. The main protagonists include Arthur Dent, an ordinary human, Ford Prefect, an alien researcher for the titular guidebook, Zaphod Beeblebrox, a two-headed, three-armed ex-President of the Galaxy, and Marvin, a depressed robot. 

From the perspective of the worldview and beliefs of people in 1979, the existence of extraterrestrial beings like Ford Prefect and Zaphod Beeblebrox, as well as advanced artificial intelligence like Marvin, would be considered highly improbable. While the idea of extraterrestrial life was a topic of interest and speculation, the specific characteristics and behaviors of these characters involve frequent and extreme violations of the known laws of the real world, such as Zaphod's anatomy and Marvin's sentience and emotional complexity. 

Therefore, the characters in ""The Hitchhiker's Guide to the Galaxy"" are invented and their existence is not possible due to the frequent and extreme violations of the laws of the real world as understood in 1979. 

Score=5","""The Hitchhiker's Guide to the Galaxy"" by Douglas Adams is a science fiction work that features a variety of invented locations, many of which require extreme violations of the laws of the real world as understood in 1979. The settings include planets, spaceships, and other cosmic phenomena that are not only fictional but also involve concepts like hyperspace travel, improbability drives, and sentient planets, which are not possible according to the scientific understanding of the time. The humor and satire in the book often rely on these fantastical elements, which are not bound by the constraints of real-world physics or geography. Therefore, the locations in the book are not possible because they require frequent or extreme violations of the laws of the real world. Score=5","""The Hitchhiker's Guide to the Galaxy"" by Douglas Adams is a science fiction work that involves a series of highly imaginative and fantastical events. The narrative includes the destruction of Earth to make way for a hyperspace bypass, interstellar travel via improbability drives, and encounters with a variety of alien species and advanced technologies. These events are not grounded in historical reality and require frequent and extreme violations of the known laws of physics and the real world. Given the worldview and beliefs of people in 1979, when the book was written, these events would still be considered impossible. Therefore, the work is best categorized as involving invented historical events whose occurrence is not possible due to frequent or extreme violations of the laws of the real world. Score=5",5,5,5,15
