"Title","Author.Creator","Year","Region","to_annotate","annotation_characters","annotation_events","annotation_settings","score_characters","score_events","score_settings","fictionility"
"Gargantua","Rabelais",1534,"France","Gargantua by Rabelais written in 1534","""Gargantua"" by François Rabelais is a satirical novel that features the character Gargantua, a giant with extraordinary size and strength. In the context of the 16th century, when the book was written, giants were part of folklore and myth, but they were not considered real or probable beings. The character of Gargantua involves significant exaggeration and fantastical elements that go beyond the natural laws as understood in Rabelais's time. While the existence of giants might have been entertained in myths and legends, the specific characteristics and actions of Gargantua, such as his immense size and feats, require moderate violations of real-world laws. Therefore, considering the historical context and the nature of the character, Gargantua would be assessed as an invented character whose existence is not possible but involves moderate violations of real-world laws. Score=5","""Gargantua"" by François Rabelais is a satirical and comedic work that features exaggerated and fantastical events. The story includes the birth and life of the giant Gargantua, whose size and actions are beyond the realm of possibility according to the natural laws understood in the 16th century. The events in the book, such as Gargantua's enormous appetite, his ability to drink entire rivers, and his interactions with other giants, involve significant violations of real-world laws as understood at the time. While the narrative is set in a recognizable historical context, the events themselves are clearly intended as fantastical and humorous exaggerations, not meant to be taken as plausible or possible within the worldview of the period. Therefore, the work involves extreme violations of real-world laws, placing it at the higher end of the scale. Score=6","""Gargantua"" by François Rabelais is a satirical and fantastical work that features a mix of real and invented locations. The narrative includes real geographical locations in France, such as Paris and the Loire Valley, but it also introduces fictional places like the Abbey of Thélème. The Abbey of Thélème, with its utopian and hedonistic characteristics, represents an invented location that would not be possible in the real world due to its idealized and fantastical nature. However, the existence of such a place involves only minor violations of real-world laws, as it primarily challenges social norms and structures rather than physical laws. Considering the worldview and beliefs of people in the 16th century, the setting of the Abbey of Thélème would be seen as a creative and imaginative construct rather than an extreme impossibility. Therefore, the work can be evaluated as having invented locations whose existence is not possible but involves minor violations of real-world laws. Score=4",5,6,4,15
"The Canterbury Tales","Geoffrey Chaucer",1400,"England","The Canterbury Tales by Geoffrey Chaucer written in 1400","""The Canterbury Tales"" by Geoffrey Chaucer is a collection of stories told by a group of pilgrims traveling to Canterbury. The main protagonists are the pilgrims themselves, who are depicted as a diverse group of individuals from various walks of life, such as the Knight, the Miller, the Wife of Bath, and the Pardoner, among others. These characters are invented by Chaucer, but they are representative of real social classes and types of people that existed in 14th-century England. Their existence is entirely possible within the historical context of the time, as they reflect the societal structure and occupations of the period. Therefore, the characters are invented but their existence would be possible according to the worldview and beliefs of people in the historical period of the work. 

Score=2","""The Canterbury Tales"" by Geoffrey Chaucer is a collection of stories told by a group of pilgrims traveling to Canterbury. The tales themselves are a mix of various genres, including fables, romances, and moral stories, and they reflect the beliefs and social norms of the 14th century. 

The events described in the tales range from plausible to fantastical. Some stories, like ""The Knight's Tale,"" involve events that could have occurred in a historical context, such as tournaments and courtly love, though they are fictionalized. Other tales, like ""The Wife of Bath's Tale,"" involve elements of folklore and magic, such as a knight encountering a magical old woman who transforms into a beautiful maiden, which would not be considered possible even by the standards of the time.

Given the mix of realistic and fantastical elements, the work as a whole involves invented historical events whose occurrence is not possible but involves minor violations of real-world laws, such as the presence of magical transformations and mythical creatures. 

Score=4","""The Canterbury Tales"" by Geoffrey Chaucer is set in real geographical locations that were well-known and believed to exist during the time it was written. The primary setting is the pilgrimage route from London to Canterbury, specifically to the shrine of Saint Thomas Becket at Canterbury Cathedral. This was a common pilgrimage route in medieval England, and the locations mentioned, such as the Tabard Inn in Southwark, are real places that existed during Chaucer's time. The work does not involve invented locations or any violations of real-world laws according to the beliefs and worldview of people in the 14th century. Therefore, the setting is based on real geographical locations. Score=0",2,4,0,6
"Faust","Johann Wolfgang von Goethe",1808,"Germany","Faust by Johann Wolfgang von Goethe written in 1808","In ""Faust"" by Johann Wolfgang von Goethe, the main protagonist, Faust, is a character based on the historical figure Johann Georg Faust, a German alchemist, astrologer, and magician who lived in the early 16th century. However, Goethe's portrayal of Faust involves significant fictionalization, particularly in the character's pact with Mephistopheles, a demon. This pact and the supernatural elements associated with it, such as the ability to perform magic and the presence of demons, involve moderate violations of real-world laws. During the time Goethe wrote the play, the belief in magic and the supernatural was still present, but the specific events and characters in the play are largely fictionalized beyond what was considered possible. Therefore, the character of Faust in Goethe's work would be assessed as an invented character whose existence is not possible but involves moderate violations of real-world laws. Score=5","""Faust"" by Johann Wolfgang von Goethe is a dramatic work that involves a pact with the devil, Mephistopheles, and explores themes of ambition, desire, and the quest for knowledge. The central event of the story—Faust making a deal with the devil—is rooted in folklore and myth rather than historical fact. In the context of the early 19th century, when Goethe wrote the play, such events were considered possible within the realm of supernatural beliefs and religious teachings, though not probable in everyday reality. The narrative involves elements like magic and supernatural intervention, which would have been seen as possible but not probable by the standards of the time. Therefore, the work involves invented historical events whose occurrence is not probable, but it does not require significant violations of real-world laws as understood in that period. 

Score=3","In ""Faust"" by Johann Wolfgang von Goethe, the settings primarily include real geographical locations, such as Germany, where the story is set. However, the work also features supernatural and fantastical elements, such as the presence of Mephistopheles and the journey to the realm of the witches. These elements introduce invented locations that involve minor violations of real-world laws, such as the Walpurgis Night scene on the Brocken, which is a real mountain but is depicted with fantastical and supernatural occurrences. Considering the worldview and beliefs of people in the early 19th century, these settings would be seen as imaginative but not entirely outside the realm of possibility, as folklore and supernatural beliefs were prevalent. Therefore, the settings in ""Faust"" involve minor violations of real-world laws. Score=4",5,3,4,12
"The Rubaiyat of Omar Khayyam","Omar Khayyam",1120,"Persia","The Rubaiyat of Omar Khayyam by Omar Khayyam written in 1120","The main protagonist in ""The Rubaiyat of Omar Khayyam"" is essentially the poet himself, Omar Khayyam, who is a real historical figure. The work is a collection of quatrains that reflect on themes such as the nature of life, the passage of time, and the pursuit of happiness. Since Omar Khayyam was a real person, and the work does not invent biographical details about him but rather presents his philosophical musings, the characters involved are real. Therefore, according to the scale provided, the work should be evaluated as having real characters, or characters believed to have existed. Score=0","""The Rubaiyat of Omar Khayyam"" is a collection of quatrains (four-line poems) attributed to the Persian polymath Omar Khayyam. The work is primarily philosophical and poetic, focusing on themes such as the nature of life, the passage of time, and the pursuit of happiness. It does not present a narrative of historical events but rather offers reflections and meditations on existence.

Given that the work is not centered around historical events, but rather philosophical musings, it does not fit neatly into the scale provided. The quatrains do not describe specific events that can be evaluated for their historical accuracy or possibility. Instead, they explore timeless human concerns and existential questions.

Therefore, since the work does not involve historical events, invented or otherwise, it is not applicable to the scale designed for evaluating historical narratives.

Score=NA","The Rubaiyat of Omar Khayyam is a collection of quatrains (rubaiyat) attributed to the Persian mathematician, astronomer, and poet Omar Khayyam. The work is primarily philosophical and reflective, focusing on themes such as the nature of life, the passage of time, and the pursuit of happiness. It does not emphasize specific geographical locations or settings in the way that a narrative or epic might. Instead, the settings are often metaphorical or symbolic, reflecting the inner landscapes of thought and emotion rather than physical places.

Given the historical context of the 12th century, the worldview of the time would not have found any of the settings in the Rubaiyat to be fantastical or impossible. The references to gardens, wine, and the natural world are grounded in the real and familiar experiences of the time. Therefore, the work does not involve invented locations or require any suspension of disbelief regarding geographical settings.

Score=0",0,NA,0,NA
"War and Peace","Leo Tolstoy",1869,"Russia","War and Peace by Leo Tolstoy written in 1869","""War and Peace"" by Leo Tolstoy is a historical novel set during the Napoleonic Wars, featuring a mix of real historical figures and fictional characters. The main protagonists, such as Pierre Bezukhov, Prince Andrei Bolkonsky, and Natasha Rostova, are invented characters whose existence would be possible within the historical context of early 19th-century Russia. These characters are crafted with realistic biographical details and social contexts that align with the period's norms and realities. Therefore, they fit the category of invented characters whose existence is possible. 

Score=2","""War and Peace"" by Leo Tolstoy is a historical novel set during the Napoleonic Wars, specifically focusing on the French invasion of Russia. The events depicted in the novel are based on actual historical events, such as the Battle of Borodino and the French retreat from Moscow. Tolstoy incorporates real historical figures like Napoleon Bonaparte and Tsar Alexander I, alongside fictional characters. While Tolstoy adds invented details and personal stories to enhance the narrative, the core events are grounded in historical reality. Therefore, according to the scale provided, the work would be classified as actual historical events with invented details. Score=1","""War and Peace"" by Leo Tolstoy is set in real geographical locations, primarily in Russia and parts of Europe during the Napoleonic Wars. The settings include cities like Moscow and St. Petersburg, as well as various battlefields and estates, all of which are real and accurately depicted according to the historical and geographical knowledge of the time. Tolstoy's detailed descriptions of these locations are based on actual places and events, with no invented geographical elements. Therefore, the work aligns with real geographical locations or those believed to exist during the period it was written. Score=0",2,1,0,3
"The Iliad","Homer",-800,"Greece","The Iliad by Homer written in -800","The main protagonists of ""The Iliad"" by Homer include characters such as Achilles, Hector, and Agamemnon. These characters are based on figures from Greek mythology and are believed to have been inspired by real historical figures or leaders from the Mycenaean period. In the context of the ancient Greek worldview, these characters were considered to be real or semi-divine heroes, and their existence was plausible within the cultural and historical framework of the time. Therefore, they would be classified as real characters with invented biographical details, as their stories are embellished with mythological elements. Score=1","The Iliad by Homer is an ancient Greek epic poem that recounts events during the Trojan War, a conflict between the city of Troy and the Greek states. The poem is based on a blend of historical events and mythological elements. While the Trojan War itself may have a basis in historical events, the specific occurrences described in The Iliad, such as the direct involvement of gods in human affairs, are rooted in Greek mythology. The ancient Greeks believed in the active participation of gods in the world, making these events plausible within their worldview. However, from a modern perspective, these events involve minor violations of real-world laws due to the supernatural elements. Therefore, considering the beliefs of the time, the events in The Iliad would be seen as possible but involve minor violations of real-world laws. Score=4","The Iliad by Homer is set in the context of the Trojan War, which is believed to have taken place in the late Bronze Age. The primary geographical locations mentioned in the epic, such as Troy (Ilium), Mycenae, Sparta, and other Greek city-states, were real places known to the ancient Greeks. While the details of these locations and the events that transpired there may be embellished or mythologized, the geographical settings themselves were based on real locations that were believed to exist by the people of that historical period. Therefore, the work involves real geographical locations with some invented details to enhance the narrative. Score=1",1,4,1,6
"The Lord of the Rings (series)","J.R.R. Tolkien",1954,"United Kingdom","The Lord of the Rings (series) by J.R.R. Tolkien written in 1954","The main protagonists of ""The Lord of the Rings"" series by J.R.R. Tolkien include characters such as Frodo Baggins, Gandalf, Aragorn, Legolas, and others. These characters are entirely invented and exist within a fictional universe that includes elements such as magic, mythical creatures, and fantastical races like hobbits, elves, and dwarves. The existence of these characters involves moderate to extreme violations of real-world laws, as they possess abilities and characteristics that are not possible in the real world, such as Gandalf's wizardry and the existence of hobbits. Considering the worldview and beliefs of people in the historical period of the work (mid-20th century), these characters are clearly fictional and not possible within the known laws of reality. Therefore, the appropriate score for the main protagonists in ""The Lord of the Rings"" series is:

Score=6","""The Lord of the Rings"" series by J.R.R. Tolkien is a high fantasy work set in the fictional world of Middle-earth. The events in the series include the existence of various mythical races such as elves, dwarves, and hobbits, as well as magical elements like wizards, enchanted rings, and mythical creatures such as dragons and orcs. The narrative involves a quest to destroy a powerful ring that has the potential to control the world, which is a central element of the plot.

From the perspective of the worldview and beliefs of people in the historical period of the work's setting, which is entirely fictional, these events are not grounded in any historical reality. The occurrence of such events would require extreme violations of real-world laws, as they involve magic and mythical beings that do not exist in the real world. Therefore, the events are entirely invented and not possible within the framework of real-world laws.

Score=6","""The Lord of the Rings"" series by J.R.R. Tolkien is set in Middle-earth, a fully invented world with its own geography, history, and cultures. Middle-earth is a fictional setting that, while richly detailed and internally consistent, does not correspond to any real geographical locations on Earth. The existence of Middle-earth involves moderate violations of real-world laws, as it includes elements such as magic, mythical creatures, and a cosmology that differs from our own. However, the world is constructed with a level of detail and realism that makes it feel plausible within its own context. Given the historical period of the work (mid-20th century), readers would understand Middle-earth as a fictional creation rather than a possible reality. Therefore, the setting of ""The Lord of the Rings"" would be evaluated as an invented location whose existence is not possible but involves moderate violations of real-world laws. Score=5",6,6,5,17
"Alice's Adventures in Wonderland","Lewis Carroll",1865,"United Kingdom","Alice's Adventures in Wonderland by Lewis Carroll written in 1865","In ""Alice's Adventures in Wonderland"" by Lewis Carroll, the main protagonist is Alice, a young girl who embarks on a fantastical journey in a dream-like world. The characters she encounters, such as the White Rabbit, the Cheshire Cat, and the Queen of Hearts, are anthropomorphic animals and fantastical beings that defy the natural laws of the real world. From the perspective of the 19th-century worldview, these characters would be considered impossible due to their talking, human-like behavior, and magical abilities. However, the story is framed as a dream, which allows for some suspension of disbelief. Despite this, the characters themselves require moderate violations of real-world laws, as they are not bound by the limitations of reality. Therefore, the existence of these characters is not possible within the context of the real world, but the narrative structure allows for some leeway in their portrayal. Score=5","""Alice's Adventures in Wonderland"" by Lewis Carroll is a classic work of literature that features a series of fantastical events. The story involves Alice falling down a rabbit hole into a whimsical world where she encounters talking animals, a disappearing cat, and a deck of playing cards that act as soldiers, among other peculiar occurrences. 

From the perspective of the 19th-century worldview, these events are clearly fantastical and not grounded in the reality of the time. The narrative includes elements such as size changes from eating and drinking, animals that speak and reason like humans, and a world that operates on nonsensical logic. These events involve significant violations of real-world laws, such as the laws of physics and biology, which would have been understood as impossible even in the 1860s.

Therefore, the events in ""Alice's Adventures in Wonderland"" are best categorized as invented historical events whose occurrence is not possible and requires extreme violations of real-world laws. 

Score=6","Alice's Adventures in Wonderland by Lewis Carroll is a classic example of a literary work featuring highly imaginative and fantastical settings. The story takes place in Wonderland, a whimsical and surreal world that defies the laws of reality as understood in the 19th century. The locations within Wonderland, such as the Mad Hatter's tea party, the Queen of Hearts' garden, and the ever-changing hallways and doors, involve significant violations of real-world laws, including logic, physics, and time. These settings are not only invented but also require extreme departures from the natural laws and scientific understanding of the Victorian era. Therefore, the existence of such locations is not possible and involves extreme violations of real-world laws. Score=6",5,6,6,17
"The Hitchhiker's Guide to the Galaxy","Douglas Adams",1979,"United Kingdom","The Hitchhiker's Guide to the Galaxy by Douglas Adams written in 1979","""The Hitchhiker's Guide to the Galaxy"" by Douglas Adams features main protagonists such as Arthur Dent, Ford Prefect, Zaphod Beeblebrox, and Marvin the Paranoid Android. These characters are largely invented and involve significant violations of real-world laws. Arthur Dent, while a human, is thrust into a universe filled with improbable and fantastical beings. Ford Prefect is an alien researcher for the titular guidebook, Zaphod Beeblebrox is a two-headed, three-armed ex-President of the Galaxy, and Marvin is a depressed robot with human-like emotions. The existence of such characters requires a suspension of disbelief and acceptance of a universe where the laws of physics and biology are bent or broken. Given the context of the late 20th century when the book was written, these characters are not possible and involve moderate to extreme violations of real-world laws. Score=6","""The Hitchhiker's Guide to the Galaxy"" by Douglas Adams is a science fiction work that involves a series of highly imaginative and fantastical events. The narrative includes the destruction of Earth to make way for a hyperspace bypass, interstellar travel using improbability drives, and encounters with various alien species and technologies. These events involve significant violations of real-world laws, such as faster-than-light travel and the manipulation of improbability. Given the worldview and beliefs of people in 1979, these events would be considered impossible and require extreme violations of known physical laws. Therefore, the work is best categorized at the higher end of the scale. Score=6","""The Hitchhiker's Guide to the Galaxy"" by Douglas Adams is a science fiction work that features a variety of invented locations, many of which involve significant violations of real-world laws as understood in 1979. The story includes planets like Magrathea, a planet-building factory, and the Heart of Gold spaceship, which utilizes the fictional Infinite Improbability Drive. These settings are not only invented but also require a suspension of known physical laws, such as the laws of physics and probability. The existence of these locations is not possible within the framework of real-world science, even considering the speculative nature of science fiction in the late 20th century. Therefore, the settings in this work involve extreme violations of real-world laws. Score=6",6,6,6,18
