"Title","Author.Creator","Year","Region","to_annotate","annotation_characters","annotation_events","annotation_settings","score_characters","score_events","score_settings","fictionility"
"The Divine Comedy","Dante Alighieri",1320,"Italy","The Divine Comedy by Dante Alighieri written in 1320","In ""The Divine Comedy"" by Dante Alighieri, the main protagonist is Dante himself, who embarks on a journey through Hell, Purgatory, and Paradise. Dante, as a historical figure, was a real person, and his character in the poem is based on his own life and experiences. However, the journey he undertakes is a fictional and allegorical one, involving encounters with various historical, mythological, and fictional characters. 

From the perspective of people in the historical period of the work, the existence of Dante as a character is real, but the journey he undertakes involves interactions with supernatural beings and realms that are not possible according to real-world laws. However, these elements are deeply rooted in the religious and cultural beliefs of the time, which accepted the existence of an afterlife and divine intervention as part of their worldview. 

Given that Dante is a real character with an invented journey that involves minor violations of real-world laws (such as traveling through the afterlife), the appropriate score is based on the character's existence and the nature of his journey. 

Score=1","The Divine Comedy by Dante Alighieri is a narrative poem that describes the journey of the protagonist, Dante, through the realms of Hell, Purgatory, and Heaven. The events depicted in the poem involve a detailed exploration of the afterlife, which includes encounters with historical and mythological figures, as well as allegorical representations of theological concepts. 

From the perspective of people in the historical period when the work was written, the existence of an afterlife was a widely held belief, and the structure of Hell, Purgatory, and Heaven as described by Dante was influenced by the religious and philosophical ideas of the time. However, the specific events and detailed descriptions of the afterlife, such as the various circles of Hell and the punishments assigned to different sins, are imaginative constructs created by Dante for the purpose of his allegory.

While the concept of an afterlife was considered possible and even probable according to the beliefs of the period, the specific events and detailed depictions in The Divine Comedy involve significant creative invention. These events require moderate violations of real-world laws, as they describe a supernatural journey that cannot occur in the physical world.

Score=5","The Divine Comedy by Dante Alighieri is a literary work that describes a journey through three realms: Inferno (Hell), Purgatorio (Purgatory), and Paradiso (Paradise). These settings are deeply rooted in the medieval Christian worldview and are not based on real geographical locations. 

1. **Inferno**: This is depicted as a series of concentric circles beneath the Earth, each representing different sins and punishments. While the concept of Hell was a widely accepted belief in the medieval period, the specific geography and structure described by Dante are invented and not possible according to real-world laws.

2. **Purgatorio**: This is portrayed as a mountain on the opposite side of the Earth from Jerusalem. The idea of Purgatory was a theological concept, but the physical mountain described by Dante does not exist and involves a moderate violation of real-world geography.

3. **Paradiso**: This realm is depicted as a series of celestial spheres surrounding the Earth, based on the Ptolemaic system. While the Ptolemaic model was accepted at the time, the specific heavenly realms described by Dante are not possible according to real-world laws.

Considering the medieval context and the theological basis for these settings, they involve moderate to extreme violations of real-world laws, but they were conceptually possible within the beliefs of the time. Therefore, the settings in The Divine Comedy are best categorized as invented locations whose existence is not possible and requires moderate violations of real-world laws.

Score=5",1,5,5,11
"Le Morte d’Arthur","Sir Thomas Malory",1485,"England","Le Morte d’Arthur by Sir Thomas Malory written in 1485","Le Morte d’Arthur by Sir Thomas Malory is a compilation of Arthurian legends, focusing on the legendary King Arthur, his knights, and the quest for the Holy Grail. The main protagonists, such as King Arthur, Sir Lancelot, and Merlin, are invented characters whose existence is not probable. However, they are based on a mix of historical figures, folklore, and mythological elements. In the context of the 15th century, these characters were often perceived as legendary but not entirely impossible, as they were rooted in the chivalric ideals and historical traditions of the time. Merlin, as a wizard, involves minor violations of real-world laws, but the other characters are more grounded in the realm of possibility, albeit improbable. Therefore, considering the historical context and beliefs of the period, the characters would be assessed as invented with improbable existence. Score=3","""Le Morte d’Arthur"" by Sir Thomas Malory is a compilation of Arthurian legends, which are a blend of historical elements and mythological embellishments. The work is set in a time that is believed to be around the late 5th to early 6th century, a period that is historically associated with the post-Roman era in Britain. 

The legends of King Arthur, the Knights of the Round Table, and the quest for the Holy Grail are central to the narrative. While there may be some historical basis for a leader like Arthur existing during this time, the specific events described in Malory's work, such as the magical elements, the existence of characters like Merlin, and the supernatural occurrences, are largely invented and involve significant violations of real-world laws as understood in the 15th century.

Given the worldview of people in the historical period when Malory wrote, the events would have been seen as legendary and not probable, but they were not entirely outside the realm of possibility due to the belief in magic and the supernatural. However, the extent of the magical and fantastical elements places the work in a category where the events are not possible and require moderate violations of real-world laws.

Score=5","""Le Morte d’Arthur"" by Sir Thomas Malory is a compilation of Arthurian legends, which are set in a mix of real and fictional locations. The work includes real geographical locations such as England and France, which were well-known to people in the 15th century. However, it also features invented places like Camelot and Avalon. 

Camelot, while a central location in Arthurian legend, is not a real place and is not based on any specific historical site. Its existence would be possible within the context of the medieval worldview, as it does not require any significant violation of the natural laws understood at the time. Avalon, on the other hand, is a mystical island associated with magic and the supernatural, which would have been seen as less probable but still within the realm of possibility given the medieval belief in magic and the supernatural.

Considering the historical context and the belief systems of the time, the invented locations in ""Le Morte d’Arthur"" involve minor violations of real-world laws, primarily due to their association with magic and the supernatural. Therefore, the work would be evaluated as involving invented locations whose existence is not possible but involves minor violations of real-world laws.

Score=4",3,5,4,12
"Don Quixote","Miguel de Cervantes",1605,"Spain","Don Quixote by Miguel de Cervantes written in 1605","In ""Don Quixote"" by Miguel de Cervantes, the main protagonist, Don Quixote, is an invented character whose existence would be possible within the context of the early 17th century. The character is a nobleman who becomes a self-styled knight-errant, inspired by the chivalric romances he has read. While his actions and beliefs are eccentric and exaggerated, they do not involve any violations of real-world laws. His existence is plausible as a person who has become delusional due to excessive reading of romantic tales, which was a conceivable scenario during Cervantes' time. Therefore, Don Quixote fits the category of invented characters whose existence would be possible. Score=2","""Don Quixote"" by Miguel de Cervantes is a satirical novel that explores the adventures of a man who believes himself to be a knight-errant. The events in the novel are largely invented and are meant to parody the chivalric romances popular during Cervantes' time. The occurrences, such as tilting at windmills and mistaking inns for castles, are exaggerated and improbable, reflecting the delusions of the protagonist. However, these events do not involve violations of real-world laws; they are simply the result of Don Quixote's misinterpretations and imagination. Given the worldview and beliefs of people in the early 17th century, these events would be seen as improbable but not impossible, as they are grounded in the character's perception rather than supernatural or fantastical elements. Therefore, the events in ""Don Quixote"" can be classified as invented historical events whose occurrence is not probable. 

Score=3","""Don Quixote"" by Miguel de Cervantes is set in various locations across Spain, primarily in the region of La Mancha. The geographical settings in the novel are based on real locations that existed during Cervantes' time. While the narrative includes some fictionalized details and embellishments typical of a picaresque novel, the locations themselves are grounded in reality and would have been recognized by contemporary readers as real places. Therefore, the work does not involve any invented locations or violations of real-world laws concerning geography. 

Score=0",2,3,0,5
"The Adventures of Tom Sawyer","Mark Twain",1876,"United States","The Adventures of Tom Sawyer by Mark Twain written in 1876","""The Adventures of Tom Sawyer"" by Mark Twain features characters that are primarily based on real-life possibilities. The main protagonist, Tom Sawyer, is a young boy living in a small town along the Mississippi River. His character, along with others like Huck Finn and Becky Thatcher, are invented but are entirely plausible within the context of 19th-century American society. These characters are drawn from the everyday life and experiences of children during that time period, reflecting the social norms and cultural environment of the era. Therefore, their existence would be possible and believable to people living in the historical period of the work. 

Score=2","""The Adventures of Tom Sawyer"" by Mark Twain is a novel set in the mid-19th century in a small town along the Mississippi River. The events in the book are largely based on the everyday life and adventures of a young boy, Tom Sawyer, and his friends. The story includes events such as playing hooky, attending school, exploring caves, and witnessing a murder. These events are reflective of the time period and are plausible within the context of the 19th-century American setting. While some details may be exaggerated for narrative effect, the events themselves are grounded in the reality of the era and are not fantastical or impossible according to the beliefs and worldview of the time. Therefore, the work can be classified as actual historical events with invented details. 

Score=1","""The Adventures of Tom Sawyer"" by Mark Twain is set in the fictional town of St. Petersburg, Missouri, which is based on the real town of Hannibal, Missouri, where Twain grew up. The geographical setting is rooted in real locations along the Mississippi River, with details that reflect the time period and environment accurately. While St. Petersburg itself is a fictional name, the setting is a realistic portrayal of a small American town in the mid-19th century. Therefore, the work involves real geographical locations with some invented details to create a fictional town that is entirely plausible within the historical context of the 1870s. Score=1",2,1,1,4
"Les Misérables","Victor Hugo",1862,"France","Les Misérables by Victor Hugo written in 1862","In ""Les Misérables"" by Victor Hugo, the main protagonists are Jean Valjean, Javert, Fantine, Cosette, Marius, and Éponine. These characters are entirely fictional but are crafted with a high degree of realism. They are set in a historical context that aligns with the early 19th-century France, and their lives and struggles reflect the social and political issues of that time. The characters' existence is entirely possible within the historical and social framework of the period in which the novel is set. There are no supernatural or fantastical elements associated with these characters that would violate real-world laws. Therefore, according to the worldview and beliefs of people in the historical period of the work, the characters are invented but their existence would be possible. Score=2","""Les Misérables"" by Victor Hugo is a novel set in early 19th-century France, primarily during the years following the Napoleonic Wars and leading up to the June Rebellion of 1832. The events depicted in the novel are largely based on actual historical events, such as the Battle of Waterloo and the aforementioned rebellion. However, Hugo embellishes these events with fictional details and characters to enhance the narrative and explore themes of justice, redemption, and social inequality.

The June Rebellion, for instance, is a real historical event, but the specific actions and outcomes involving the characters in the novel are invented. These fictional elements are plausible within the historical context and do not require any suspension of disbelief regarding the laws of nature or historical possibility.

Given that the novel incorporates actual historical events with invented details that are plausible within the historical context, the appropriate score for ""Les Misérables"" is:

Score=1","""Les Misérables"" by Victor Hugo is set in real geographical locations in France, primarily in Paris and its surrounding areas. The novel meticulously describes the streets, neighborhoods, and landmarks of 19th-century Paris, which were well-known and existed during the time Hugo wrote the book. While Hugo may have added some fictional details or embellishments to enhance the narrative, the settings themselves are based on real places that were familiar to his contemporary readers. Therefore, the work involves real geographical locations with some invented details to serve the story. Score=1",2,1,1,4
"One Hundred Years of Solitude","Gabriel García Márquez",1967,"Colombia","One Hundred Years of Solitude by Gabriel García Márquez written in 1967","In ""One Hundred Years of Solitude"" by Gabriel García Márquez, the main protagonists are members of the Buendía family. The characters are invented, but their existence would be possible within the context of the novel's setting, which is a fictional town in Colombia. The characters exhibit traits and behaviors that are grounded in human nature and societal norms, making their existence plausible. However, the novel is a quintessential example of magical realism, where fantastical elements are interwoven with the mundane. Despite this, the characters themselves do not inherently violate real-world laws; rather, it is the events and occurrences around them that do. Therefore, the characters' existence is possible, and they are not subject to the magical elements that would make their existence improbable or impossible. Score=2","""One Hundred Years of Solitude"" by Gabriel García Márquez is a seminal work of magical realism, a genre that blends fantastical elements with realistic settings and events. The novel chronicles the multi-generational story of the Buendía family in the fictional town of Macondo. 

The events in the novel include numerous instances of magical realism, such as characters who live for over a century, a rain of yellow flowers, and a character who ascends to heaven. These events are not possible according to real-world laws, but they are presented in a way that is seamlessly integrated into the narrative, reflecting the beliefs and cultural narratives of Latin American folklore and myth.

Given the worldview and beliefs of the characters within the novel, these events are accepted as part of their reality. However, from an objective standpoint, they involve moderate to extreme violations of real-world laws, such as gravity and mortality. Therefore, the events in ""One Hundred Years of Solitude"" would be classified as invented historical events whose occurrence is not possible and requires moderate to extreme violations of real-world laws.

Score=5","""One Hundred Years of Solitude"" by Gabriel García Márquez is set in the fictional town of Macondo. Macondo is an invented location, but it is crafted with such vivid detail and cultural authenticity that it feels like a plausible place within the context of Latin American geography and history. The town is depicted with realistic elements that reflect the socio-political and cultural environment of Colombia and Latin America during the time periods covered in the novel. The existence of Macondo would be possible within the worldview and beliefs of people in the mid-20th century, as it does not require any violations of real-world laws. Therefore, the setting of Macondo can be classified as an invented location whose existence would be possible. Score=2",2,5,2,9
"Voyage dans la lune","Cyrano de Bergerac",NA,"","Voyage dans la lune by Cyrano de Bergerac written in NA","""Voyage dans la lune"" by Cyrano de Bergerac is a work of early science fiction written in the 17th century. The main protagonist is a fictionalized version of Cyrano himself, who embarks on a fantastical journey to the moon. In the context of the 17th century, the idea of traveling to the moon was purely speculative and involved significant violations of the real-world laws as understood at the time. The protagonist's journey involves imaginative technologies and concepts that were not possible according to the scientific knowledge of that era. Therefore, the character's existence and the nature of his journey would require moderate violations of real-world laws as perceived in the 17th century. Score=5","""Voyage dans la lune"" by Cyrano de Bergerac, written in the 17th century, is a work that describes a fictional journey to the moon. During this period, the concept of space travel was purely speculative and not grounded in scientific reality. The events described in the book, such as traveling to the moon using fantastical methods like being lifted by dew or using fireworks, involve significant violations of the real-world laws of physics as understood even in the 17th century. While the idea of celestial travel was a topic of philosophical and speculative interest, the methods and events described in the work are not possible according to the scientific knowledge of the time. Therefore, the work involves moderate to extreme violations of real-world laws from the perspective of the 17th century. Score=5","""Voyage dans la lune"" by Cyrano de Bergerac, written in the 17th century, is a work that explores the idea of traveling to the moon. During this period, the moon was a subject of fascination and speculation, but it was not considered a real geographical location that humans could visit. The moon was known to exist, but the details of its surface and the possibility of traveling there were purely speculative and imaginative.

In the context of the 17th century, the idea of a voyage to the moon involved significant imaginative leaps and was not grounded in the scientific understanding of the time. The moon was an invented location in terms of human exploration, and the concept of traveling there required moderate violations of the real-world laws as understood in that era. The narrative includes fantastical elements and methods of travel that were not possible according to the scientific knowledge of the time.

Therefore, considering the historical context and the imaginative nature of the setting, the work can be evaluated as involving moderate violations of real-world laws. Score=5",5,5,5,15
"The Lusiads","Luís de Camões",1572,"Portugal","The Lusiads by Luís de Camões written in 1572","""The Lusiads"" by Luís de Camões is an epic poem that primarily focuses on the real historical figure of Vasco da Gama, a Portuguese explorer who was the first European to reach India by sea. The poem celebrates his voyage and the broader Portuguese explorations during the Age of Discovery. While the narrative includes mythological elements and divine interventions, the main protagonist, Vasco da Gama, is a real character who existed in history. The poem does not significantly alter his biographical details beyond the typical embellishments found in epic poetry. Therefore, considering the historical context and the worldview of the 16th century, Vasco da Gama's character would be evaluated as real. 

Score=0","""The Lusiads"" by Luís de Camões is an epic poem that primarily recounts the Portuguese voyages of discovery during the Age of Exploration, focusing on Vasco da Gama's journey to India. The work blends historical events with mythological and fantastical elements. 

From the perspective of the 16th-century worldview, the historical events, such as the voyage itself and encounters with various peoples and places, are based on actual occurrences. However, Camões embellishes these events with mythological figures like gods and nymphs, which were not believed to be real by the people of the time but were used as literary devices to enhance the narrative.

Given the historical context, the core events of the voyage are actual historical events with some invented details for dramatic effect. The inclusion of mythological elements would have been seen as a poetic embellishment rather than a literal account. Therefore, the work can be classified as actual historical events with invented details.

Score=1","""The Lusiads"" by Luís de Camões is an epic poem that primarily recounts the voyages of Portuguese explorers, particularly Vasco da Gama's journey to India. The settings in the poem include real geographical locations such as Lisbon, the Cape of Good Hope, and Calicut, which were known and believed to exist during the time the poem was written. However, Camões also incorporates mythological and fantastical elements, such as the Island of Love, which is an invented location. This island, while fantastical, involves minor violations of real-world laws, as it is depicted as a paradise created by the gods for the sailors. Given the historical context of the 16th century, the inclusion of such mythological elements would have been seen as a poetic embellishment rather than a serious geographical claim. Therefore, the work involves invented locations whose existence is not possible but involves minor violations of real-world laws. Score=4",0,1,4,5
