"Title","Author.Creator","Year","Region","to_annotate","annotation_characters","annotation_events","annotation_settings","score_characters","score_events","score_settings","fictionility"
"In Cold Blood","Truman Capote",1966,"United States","In Cold Blood by Truman Capote written in 1966","""In Cold Blood"" by Truman Capote is a non-fiction novel that details the real-life murders of the Clutter family in Holcomb, Kansas, in 1959. The main protagonists, including the murderers Perry Smith and Richard ""Dick"" Hickock, as well as the Clutter family members, are all real individuals who existed and whose lives and actions are documented. Capote's work is based on extensive research and interviews, and while it may include some narrative embellishments for dramatic effect, the characters themselves are real and believed to have existed. Therefore, according to the specified scale, the work should be evaluated as having real characters. Score=0","""In Cold Blood"" by Truman Capote is a non-fiction novel that details the real-life events surrounding the 1959 murders of the Clutter family in Holcomb, Kansas. Capote conducted extensive research and interviews to create a narrative that closely follows the actual events. While some dialogue and minor details may have been invented or dramatized for narrative effect, the core events are based on true occurrences. Therefore, the work primarily represents actual historical events with some invented details for storytelling purposes. Score=1","""In Cold Blood"" by Truman Capote is a non-fiction novel that details the real-life events surrounding the 1959 murders of the Clutter family in Holcomb, Kansas. The setting is based on actual geographical locations, specifically the small town of Holcomb and other real places in Kansas. Capote's work is grounded in reality, with no invented locations or fantastical elements. The geographical settings are described with accuracy and detail, reflecting real places that existed at the time of the events. Therefore, the work involves real geographical locations or those believed to exist, without any invention or violation of real-world laws. Score=0",0,1,0,1
"The Stranger","Albert Camus",1942,"France","The Stranger by Albert Camus written in 1942","""The Stranger"" by Albert Camus features the main protagonist, Meursault, who is a character grounded in the reality of the 20th century. Meursault is depicted as an ordinary man living in French Algeria, whose actions and thoughts are shaped by existential themes. His character is entirely plausible within the context of the time period and does not involve any supernatural or fantastical elements. The narrative focuses on his emotional detachment and existential reflections, which are realistic and possible for a human being of that era. Therefore, Meursault is an invented character whose existence would be possible. Score=2","""The Stranger"" by Albert Camus is a novel that primarily deals with existential themes and the absurdity of life. The events in the book revolve around the protagonist, Meursault, and his experiences, including the murder of an Arab man and the subsequent trial. These events are set in a realistic context and are plausible within the historical and social setting of French Algeria in the 1940s. There are no supernatural or fantastical elements involved, and the events could have realistically occurred during that time period. Therefore, the work aligns with actual historical events or events that could have plausibly happened, albeit with fictional characters and specific circumstances. 

Score=2","""The Stranger"" by Albert Camus is set in Algiers, the capital city of Algeria, during the French colonial period. Algiers is a real geographical location, and the novel's setting is based on the actual city as it existed in the early 20th century. The descriptions of the city, its climate, and its social environment are grounded in reality and reflect the historical and cultural context of the time. There are no invented locations or elements that violate real-world laws. Therefore, the setting of ""The Stranger"" aligns with real geographical locations or those believed to exist during the period in which the novel was written. Score=0",2,2,0,4
"Sherlock Holmes","Conan Doyle",1887,"United Kingdom","Sherlock Holmes by Conan Doyle written in 1887","Sherlock Holmes, created by Arthur Conan Doyle in 1887, is a fictional character who is a detective with extraordinary observational and deductive skills. During the late 19th century, the concept of a detective with such abilities was plausible, as the profession of private detective was well-established, and the methods Holmes used were based on logical reasoning and scientific principles. While Holmes himself is an invented character, his existence would be possible within the context of the time period, as he does not possess any supernatural abilities or require any violations of real-world laws. Therefore, according to the scale provided, Sherlock Holmes would be classified as an invented character whose existence would be possible. Score=2","The literary work ""Sherlock Holmes"" by Arthur Conan Doyle, first introduced in 1887, primarily revolves around the detective adventures of Sherlock Holmes and his companion Dr. John Watson. The stories are set in a realistic version of Victorian London and involve solving various mysteries and crimes. The events depicted in the stories are largely based on actual historical contexts and practices of detective work during that period, albeit with some creative embellishments and fictional cases. The methods used by Holmes, such as deduction and forensic science, were innovative for the time but not beyond the realm of possibility. Therefore, the events can be considered actual historical events with invented details, as they are plausible within the historical context of the late 19th century. Score=1","The settings in the Sherlock Holmes stories by Arthur Conan Doyle, particularly in the first novel ""A Study in Scarlet"" (1887), are primarily based in real geographical locations, such as London and other parts of England. These locations are depicted with a high degree of accuracy and detail that reflect the real world of the late 19th century. Doyle's descriptions of places like Baker Street, where Holmes resides, and other parts of London are grounded in the reality of the time, with no invented geographical elements that would challenge the beliefs or understanding of people in that historical period. Therefore, the settings in Sherlock Holmes are real geographical locations or believed to exist, with no significant invention or deviation from reality. Score=0",2,1,0,3
"The French Lieutenant's Woman","John Fowles",1969,"United Kingdom","The French Lieutenant's Woman by John Fowles written in 1969","""The French Lieutenant's Woman"" by John Fowles is a novel set in the Victorian era, and it features characters that are entirely fictional but crafted to fit within the historical and social context of the time. The main protagonists, such as Charles Smithson and Sarah Woodruff, are invented characters whose existence would be possible within the 19th-century setting. They are depicted with realistic traits and behaviors that align with the societal norms and expectations of the Victorian period. The novel does not involve any supernatural or fantastical elements that would violate real-world laws. Therefore, considering the historical context and the nature of the characters, the appropriate score is:

Score=2","""The French Lieutenant's Woman"" by John Fowles is a novel set in the Victorian era, and it intertwines historical events with fictional narratives. The novel does not focus on specific historical events but rather on the social and cultural context of the time. The events depicted in the novel, such as the social interactions, the constraints of Victorian society, and the personal dilemmas faced by the characters, are plausible within the historical period. The novel does not involve any significant violations of real-world laws or historical facts. Instead, it presents a fictional story that could have occurred within the framework of the 19th-century setting. Therefore, the events are invented but possible within the historical context of the time. 

Score=2","""The French Lieutenant's Woman"" by John Fowles is set in the Victorian era, primarily in the town of Lyme Regis on the Dorset coast of England. Lyme Regis is a real geographical location, and the novel incorporates real historical and geographical details about the area. Fowles adds some fictional elements to the setting, such as specific buildings or locations within the town that may not have existed, but these are plausible within the context of the real-world setting. Given the historical period of the novel, the setting would have been perceived as entirely real by contemporary standards, with no significant deviations from reality. Therefore, the work falls into the category of real geographical locations with invented details. Score=1",2,2,1,5
"Midnight's Children","Salman Rushdie",1981,"India/United Kingdom","Midnight's Children by Salman Rushdie written in 1981","""Midnight's Children"" by Salman Rushdie is a novel that features the protagonist Saleem Sinai, who is born at the exact moment of India's independence and possesses telepathic powers. The novel is a blend of magical realism and historical fiction, where the characters are deeply intertwined with the historical events of India. 

Saleem Sinai, as a character, is an invented individual whose existence would not be possible in the real world due to his supernatural abilities, such as telepathy and an extraordinarily sensitive sense of smell. These abilities represent moderate violations of real-world laws, as they introduce elements of magic and the supernatural that are not grounded in reality. 

Considering the historical period of the work, which is set in the mid-20th century, the worldview and beliefs of people at that time would not support the existence of such supernatural abilities. Therefore, Saleem Sinai's character falls into the category of invented characters whose existence is not possible but involves moderate violations of real-world laws.

Score=5","""Midnight's Children"" by Salman Rushdie is a novel that intertwines historical events with magical realism. The story is set against the backdrop of actual historical events in India, such as the partition and independence, but it introduces fantastical elements, particularly the magical powers of the children born at the stroke of midnight on India's independence day. These magical elements, such as telepathy and time manipulation, are not possible according to real-world laws. However, the historical context and events are grounded in reality, with the magical aspects serving as a metaphorical layer rather than a literal one. Given the blend of real historical events with significant fantastical elements, the work involves moderate violations of real-world laws. Therefore, the appropriate score is:

Score=5","""Midnight's Children"" by Salman Rushdie is set primarily in real geographical locations, including Bombay (now Mumbai), Kashmir, and other parts of India and Pakistan. These settings are depicted with a mix of historical and fictional details, reflecting the socio-political landscape of the Indian subcontinent during and after the partition. While the narrative includes magical realism elements, such as characters with supernatural abilities, the geographical settings themselves are based on real locations with some invented details to enhance the story's magical realism. Therefore, considering the historical period and the worldview of the time, the settings can be classified as real locations with invented details. Score=1",5,5,1,11
"The Odyssey","Homer",-800,"Greece","The Odyssey by Homer written in -800","The main protagonist of ""The Odyssey"" is Odysseus, a character who, according to the beliefs of the ancient Greeks, was considered a real historical figure. The ancient Greeks believed in the existence of heroes who were often semi-divine or had divine favor, and Odysseus was one such hero. While his adventures involve encounters with mythical creatures and gods, Odysseus himself was believed to be a real person, possibly a king of Ithaca. Therefore, from the perspective of the historical period in which ""The Odyssey"" was composed, Odysseus would be considered a real character, or at least believed to have existed. Score=0","The Odyssey by Homer is an epic poem that recounts the journey of Odysseus as he attempts to return home after the Trojan War. The narrative includes a mix of actual historical events, such as the Trojan War, which was believed to have occurred, and a series of fantastical adventures involving mythical creatures and divine interventions. These include encounters with the Cyclops, Sirens, and the witch-goddess Circe, as well as Odysseus's interactions with gods like Athena and Poseidon.

In the context of the ancient Greek worldview, the existence of gods and mythical creatures was considered plausible, and divine intervention in human affairs was a common belief. However, from a modern perspective, these events involve significant violations of real-world laws, such as the existence of one-eyed giants and transformations of humans into animals.

Given the ancient Greek belief system, these events would be seen as improbable but not entirely impossible within their mythological framework. Therefore, the work involves invented historical events whose occurrence is not probable according to the beliefs of the time.

Score=3","The Odyssey by Homer, written around 800 BCE, features a blend of real and fantastical locations. The journey of Odysseus includes real geographical locations such as Ithaca, Troy, and various parts of the Mediterranean, which were known to the ancient Greeks. However, it also includes invented locations like the island of the Cyclopes, the land of the Lotus-Eaters, and the realm of the dead, which involve mythical elements and creatures. 

From the perspective of the ancient Greeks, these locations were part of their mythological worldview and were considered possible within the context of their beliefs about the world and the divine. The existence of such places would not have been seen as entirely impossible, but they do involve minor violations of real-world laws, such as the presence of mythical creatures and divine interventions.

Therefore, considering the historical context and the belief systems of the time, the settings in The Odyssey would be evaluated as invented locations whose existence is not possible but involves minor violations of real-world laws. 

Score=4",0,3,4,7
"Hamlet","William Shakespeare",1600,"England","Hamlet by William Shakespeare written in 1600","In ""Hamlet"" by William Shakespeare, the main protagonist is Prince Hamlet of Denmark. The character of Hamlet is an invented character, but his existence would be possible within the context of the historical period in which the play is set. The play is set in a royal court, and the existence of a prince dealing with issues of succession, family betrayal, and political intrigue is plausible. The character does not involve any supernatural abilities or extreme violations of real-world laws, although the play does include a ghost, which is a separate element not to be considered in this evaluation. Therefore, based on the character of Hamlet himself, the degree of invention aligns with invented characters whose existence would be possible. Score=2","In evaluating ""Hamlet"" by William Shakespeare, we focus on the events within the play. The central events include the ghost of King Hamlet appearing to Prince Hamlet, the notion of a ghost seeking revenge, and the subsequent series of actions leading to multiple deaths. During the Elizabethan era, belief in ghosts and the supernatural was common, and the idea of a ghost appearing to demand vengeance would have been considered possible, if not probable, by contemporary audiences. The events, while dramatic and tragic, do not involve violations of real-world laws as understood at the time. Therefore, the events in ""Hamlet"" can be seen as invented historical events whose occurrence would be possible within the worldview of the period. Score=2","In ""Hamlet"" by William Shakespeare, the primary setting is Elsinore Castle in Denmark. During the time the play was written, Denmark was a real geographical location, and Elsinore (Helsingør) is a real town in Denmark. The castle in the play is based on Kronborg Castle, which is also a real place. Shakespeare's depiction of Elsinore includes some dramatic embellishments typical of his works, but these do not significantly alter the reality of the location as understood in the early 17th century. Therefore, the setting involves real geographical locations with some invented details for dramatic purposes. Score=1",2,2,1,5
"Moby-Dick","Herman Melville",1851,"United States","Moby-Dick by Herman Melville written in 1851","In ""Moby-Dick"" by Herman Melville, the main protagonist is Captain Ahab, who is on a quest to hunt the titular white whale, Moby Dick. Ahab is a human character, a sea captain, which is entirely plausible within the historical context of the 19th century. His obsession and monomaniacal pursuit of the whale are exaggerated for dramatic effect, but they do not violate any real-world laws or historical beliefs of the time. The character of Ishmael, the narrator, is also a plausible figure as a sailor and observer of the events. Therefore, the characters are invented but their existence would be possible within the worldview and beliefs of people in the 19th century. Score=2","""Moby-Dick"" by Herman Melville is a novel that, while fictional, is grounded in the real-world context of 19th-century whaling. The central event of the story is Captain Ahab's obsessive pursuit of the great white whale, Moby Dick. Whaling was a common and dangerous occupation during this period, and the existence of large, formidable whales was well-documented. However, the specific events of the novel, such as the whale's seemingly intentional vendetta against Ahab and the dramatic final confrontation, are embellished for narrative effect. These events are possible within the context of the time, as they do not violate the known laws of nature or the beliefs of the period, but they are not probable given the typical behavior of whales. Therefore, the events in ""Moby-Dick"" can be classified as invented historical events whose occurrence is not probable. Score=3","""Moby-Dick"" by Herman Melville is set in real geographical locations, primarily focusing on the seas and oceans, particularly the Pacific Ocean, as well as real ports and islands such as Nantucket and the Azores. The novel's settings are based on actual places known to 19th-century readers, and the details provided about these locations are consistent with the knowledge and beliefs of that time. While Melville may embellish certain aspects for narrative effect, the geographical settings themselves are grounded in reality and were believed to exist by the people of the period. Therefore, the work falls into the category of real geographical locations or those believed to exist. Score=0",2,3,0,5
"Pride and Prejudice","Jane Austen",1813,"United Kingdom","Pride and Prejudice by Jane Austen written in 1813","""Pride and Prejudice"" by Jane Austen, written in 1813, features characters that are entirely invented but whose existence would be possible within the context of early 19th-century England. The main protagonists, such as Elizabeth Bennet and Mr. Darcy, are portrayed as realistic individuals with plausible social interactions, behaviors, and concerns reflective of the Regency era. The characters are grounded in the social norms and class structures of the time, making their existence entirely plausible. Therefore, according to the scale provided, the characters fall under the category of invented characters whose existence would be possible. Score=2","""Pride and Prejudice"" by Jane Austen is a novel set in the early 19th century, focusing on the lives and relationships of the British gentry. The events depicted in the novel, such as social gatherings, courtship, and marriage, are reflective of the actual societal norms and practices of the time. The narrative does not involve any invented historical events or violations of real-world laws. Instead, it portrays realistic scenarios that could have occurred during that period. Therefore, the events in ""Pride and Prejudice"" align with actual historical events or those believed to have occurred during the early 1800s. 

Score=0","""Pride and Prejudice"" by Jane Austen is set in early 19th-century England, primarily in rural areas such as Hertfordshire, Derbyshire, and Kent. These are real geographical locations that existed during the time the novel was written. The settings are depicted with realistic details that reflect the social and cultural context of the period. There are no invented locations or elements that violate real-world laws. Therefore, the settings in ""Pride and Prejudice"" align with real geographical locations or those believed to exist at the time. 

Score=0",2,0,0,2
"The Catcher in the Rye","J.D. Salinger",1951,"United States","The Catcher in the Rye by J.D. Salinger written in 1951","""The Catcher in the Rye"" by J.D. Salinger features the protagonist Holden Caulfield, a character who is a teenage boy navigating the complexities of adolescence in mid-20th century America. Holden is a realistic character, grounded in the social and cultural context of the time. His experiences, thoughts, and behaviors are reflective of a real person who could have existed during that period. There are no elements of his character that require suspension of disbelief or involve violations of real-world laws. Therefore, based on the scale provided, Holden Caulfield would be evaluated as a real character whose existence is entirely plausible. Score=0","""The Catcher in the Rye"" by J.D. Salinger is a novel that primarily revolves around the experiences and thoughts of its protagonist, Holden Caulfield, as he navigates life in New York City after being expelled from prep school. The events depicted in the novel are grounded in the social and cultural context of the 1950s and reflect the realistic experiences of a teenager during that time. There are no invented historical events or violations of real-world laws; the narrative is a plausible depiction of a young person's life and struggles. Therefore, the events in the novel align with actual historical events or those believed to have occurred during the period it was written. 

Score=0","""The Catcher in the Rye"" by J.D. Salinger is set in real geographical locations, primarily in New York City and Pennsylvania. These settings are depicted with realistic details that align with the actual geography and urban environment of the time. The novel does not involve any invented locations or require any suspension of disbelief regarding the existence of its settings. Therefore, the work is grounded in real-world geography as understood in the 1950s. Score=0",0,0,0,0
"The Road","Cormac McCarthy",2006,"United States","The Road by Cormac McCarthy written in 2006","""The Road"" by Cormac McCarthy is a post-apocalyptic novel featuring two main protagonists: a father and his young son. These characters are entirely invented by the author, but their existence is possible within the context of the novel's setting. The story is set in a world that has experienced a catastrophic event, but the characters themselves are human and do not possess any supernatural or extraordinary traits that would violate real-world laws. Given the historical period of the work (contemporary to its publication), the existence of such characters is entirely plausible. Therefore, the characters fall into the category of invented characters whose existence would be possible. Score=2","""The Road"" by Cormac McCarthy is a post-apocalyptic novel that depicts a world devastated by an unspecified cataclysmic event. The events in the novel revolve around the survival journey of a father and his son through a barren, ash-covered landscape. Given the context of the novel, the catastrophic event and its aftermath are invented historical events. However, the occurrence of such an event is within the realm of possibility, as it could be interpreted as a result of nuclear war, environmental disaster, or other large-scale calamities that are conceivable within the laws of physics and human history. Therefore, the events in the novel would be classified as invented but possible, aligning with the worldview and beliefs of people in the contemporary period of the work's publication. 

Score=2","""The Road"" by Cormac McCarthy is set in a post-apocalyptic world that is a speculative extension of our current reality. The geographical locations in the novel are real, as the story takes place in the United States, but the details of the environment are altered to reflect the aftermath of an unspecified cataclysmic event. This setting involves a world that is bleak, barren, and largely devoid of life, which is a plausible scenario given the context of the narrative. The existence of such a setting is possible within the realm of speculative fiction, as it does not require any violations of real-world laws, only an extension of current possibilities. Therefore, the setting can be classified as real geographical locations with invented details. Score=1",2,2,1,5
