"Title","Author.Creator","Year","Region","to_annotate","annotation_characters","annotation_settings","annotation_events","score_characters","score_events","score_settings","fictionility"
"In Cold Blood","Truman Capote",1966,"United States","In Cold Blood by Truman Capote written in 1966","""In Cold Blood"" by Truman Capote is a non-fiction novel that details the real-life murders of the Clutter family in Holcomb, Kansas, in 1959. The main protagonists of the work are the murderers, Perry Smith and Richard ""Dick"" Hickock, as well as the Clutter family members. These characters are real individuals who were documented to have existed, and the events surrounding them were thoroughly researched by Capote. While Capote may have added some narrative flair or psychological depth to the characters, the core biographical details are based on real people and events. Therefore, according to the scale provided, the characters in ""In Cold Blood"" are real and documented. Score=0","""In Cold Blood"" by Truman Capote is a non-fiction novel that details the real-life events surrounding the 1959 murders of the Clutter family in Holcomb, Kansas. The settings in the book are based on actual geographical locations, such as the town of Holcomb and other parts of Kansas, which are documented to exist. Capote's work is known for its meticulous attention to detail and factual accuracy regarding these locations. Therefore, the settings in ""In Cold Blood"" align with real geographical locations that are known and documented to exist. 

Score=0","""In Cold Blood"" by Truman Capote is a non-fiction novel that details the real-life events surrounding the 1959 murders of the Clutter family in Holcomb, Kansas. Capote conducted extensive research, including interviews and investigations, to accurately portray the events and the people involved. While some dialogue and minor details may have been dramatized or invented for narrative purposes, the core events are based on actual historical occurrences that are well-documented. Therefore, the work primarily represents actual historical events with some invented details for storytelling purposes. Score=1",0,1,0,1
"The Stranger","Albert Camus",1942,"France","The Stranger by Albert Camus written in 1942","""The Stranger"" by Albert Camus is a novel centered around the character Meursault, a French Algerian who is depicted as emotionally detached and indifferent to societal norms. Meursault is a fictional character, but his existence is entirely plausible within the context of the 1940s. The character's behaviors and attitudes, while unconventional, do not violate any laws of the real world. They reflect existential themes and the absurdity of life, which are central to Camus's philosophy. Given the historical period and the worldview of the time, Meursault's character is an invented one whose existence is probable. Therefore, the appropriate score for Meursault as a character is:

Score=2","""The Stranger"" by Albert Camus is set in Algiers, the capital city of Algeria, during the French colonial period. The locations described in the novel, such as the beach, the courtroom, and the streets of Algiers, are real geographical locations known to exist. Camus provides a detailed and realistic depiction of these settings, reflecting the actual environment of Algiers in the early 20th century. Since the novel's settings are based on real places without any invented or fantastical elements, they align with the worldview and beliefs of people in the historical period of the work. Therefore, the degree of invention is minimal, and the settings are entirely possible and documented. 

Score=0","""The Stranger"" by Albert Camus is a novel set in French Algeria in the 1940s. The events depicted in the book revolve around the life of the protagonist, Meursault, and include his experiences, such as attending his mother's funeral, forming relationships, and ultimately committing a murder. These events are grounded in the social and legal realities of the time and place in which the story is set. The narrative does not involve any historical events that are invented or improbable, nor does it require any violations of the laws of the real world. The events are plausible and could have occurred in the historical context of the 1940s. Therefore, the work aligns with actual historical events, known or documented to have occurred, albeit with invented details specific to the fictional narrative. 

Score=1",2,1,0,3
"Sherlock Holmes","Conan Doyle",1887,"United Kingdom","Sherlock Holmes by Conan Doyle written in 1887","Sherlock Holmes, created by Arthur Conan Doyle in 1887, is a fictional character who is a consulting detective known for his keen observation and logical reasoning. While Holmes is an invented character, his existence is probable within the context of the late 19th-century setting. The character is based on real-life individuals, such as Dr. Joseph Bell, who was known for his deductive skills, and the profession of detective work was well-established by that time. Therefore, Holmes represents an invented character whose existence is plausible given the historical context and societal beliefs of the period. Score=2","The settings in the Sherlock Holmes stories by Arthur Conan Doyle, beginning with ""A Study in Scarlet"" in 1887, are primarily based on real geographical locations. The stories are set in London and other parts of England, which are well-documented and known to exist. Doyle's depiction of London includes real streets, landmarks, and neighborhoods, although he sometimes adds fictional details, such as the famous 221B Baker Street address, which did not exist at the time. However, these fictional elements are minor and do not significantly alter the reality of the geographical setting. Considering the worldview and beliefs of people in the late 19th century, the settings would be seen as real with some invented details. Therefore, the appropriate score is:

Score=1","Sherlock Holmes by Arthur Conan Doyle, first introduced in 1887, is a series of detective stories set in the late 19th and early 20th centuries. The events in these stories revolve around the investigations conducted by the fictional detective Sherlock Holmes and his companion Dr. John Watson. The cases often involve intricate plots, clever deductions, and sometimes elaborate schemes. 

While the stories are fictional, the events depicted are grounded in the reality of the time, with plausible scenarios and methods of investigation that reflect the period's understanding of crime and detection. The use of forensic science, logical reasoning, and observation are all consistent with the practices and beliefs of the late 19th century. Therefore, the events are invented but their occurrence is probable within the context of the time.

Score=2",2,2,1,5
"The French Lieutenant's Woman","John Fowles",1969,"United Kingdom","The French Lieutenant's Woman by John Fowles written in 1969","""The French Lieutenant's Woman"" by John Fowles is a novel set in the Victorian era, featuring characters that are entirely fictional. The main protagonists, such as Sarah Woodruff and Charles Smithson, are invented by the author. However, their existence is probable within the context of the 19th-century English society depicted in the novel. The characters are crafted with realistic traits and behaviors that align with the social norms and historical context of the time. Therefore, they do not require any violations of the laws of the real world to exist. Given the historical period and the worldview of the time, these characters could plausibly have existed. Score=2","""The French Lieutenant's Woman"" by John Fowles is set in the Victorian era, primarily in the town of Lyme Regis on the Dorset coast of England. Lyme Regis is a real geographical location, known for its picturesque landscapes and historical significance, particularly in the context of the Victorian period. Fowles incorporates real locations with a high degree of historical accuracy, although he may add some fictional details to enhance the narrative. However, these details do not alter the fundamental reality of the setting. Given the historical context and the fact that the locations are real and documented to exist, the work should be evaluated as follows:

Score=0","""The French Lieutenant's Woman"" by John Fowles is a novel set in the Victorian era, specifically in the 1860s. The narrative intertwines actual historical events and societal norms of the time with fictional elements. The novel explores themes such as social class, gender roles, and the constraints of Victorian society, which are grounded in historical reality. However, the specific events and plot developments, such as the romantic entanglements and personal choices of the characters, are invented by the author. These fictional events are plausible within the context of the Victorian period, as they do not require any violations of the laws of the real world or the beliefs of the time. Therefore, the invented historical events in the novel are probable given the societal norms and conditions of the 19th century. 

Score=2",2,2,0,4
"Midnight's Children","Salman Rushdie",1981,"India/United Kingdom","Midnight's Children by Salman Rushdie written in 1981","""Midnight's Children"" by Salman Rushdie is a novel that features a blend of historical and fantastical elements, with its main protagonist, Saleem Sinai, being a fictional character. Saleem is born at the exact moment of India's independence and is endowed with telepathic powers, which he uses to connect with other children born in the first hour of India's independence, each of whom has their own magical abilities. 

From the perspective of the historical period in which the novel is set, the existence of a character like Saleem, with telepathic powers and a connection to other magically gifted children, would not be considered probable. The novel employs magical realism, a literary style that incorporates fantastical elements into a realistic setting, which would have been seen as a significant departure from the natural laws of the real world by the standards of the time.

Therefore, considering the worldview and beliefs of the historical period depicted in the novel, the existence of Saleem Sinai and his magical abilities would require frequent or extreme violations of the laws of the real world. 

Score=5","""Midnight's Children"" by Salman Rushdie is set primarily in real geographical locations, such as Bombay (now Mumbai), Kashmir, and other parts of India and Pakistan. These are real places known to exist, and the novel incorporates historical events and cultural contexts that are accurate to the time period it covers. However, Rushdie infuses these settings with magical realism, adding fantastical elements that are not part of the real world, such as the telepathic connection among the children born at the moment of India's independence. Despite these fantastical elements, the geographical locations themselves remain real and documented. Therefore, the setting of the novel aligns with real geographical locations with invented details. 

Score=1","""Midnight's Children"" by Salman Rushdie is a novel that blends historical events with magical realism. The story is set against the backdrop of actual historical events in India, such as the partition of India and Pakistan, the independence of India, and the Emergency period. However, the novel introduces fantastical elements, such as the protagonist Saleem Sinai's telepathic abilities and the existence of other children with magical powers born at the stroke of midnight on India's independence day.

From the perspective of the historical period in which the novel is set, the actual historical events are well-documented and known to have occurred. However, the magical elements, such as telepathy and other supernatural abilities, are not possible within the framework of the real world, even considering the beliefs of the time. These elements require frequent and extreme violations of the laws of the real world.

Therefore, while the historical context is real, the invented magical events are not possible. According to the specified scale, this places the work at a level where the occurrence of these events is not possible due to frequent or extreme violations of the laws of the real world.

Score=5",5,5,1,11
"The Odyssey","Homer",-800,"Greece","The Odyssey by Homer written in -800","The main protagonist of ""The Odyssey"" is Odysseus, a character from ancient Greek mythology. In the context of the historical period in which the work was composed, the Greeks believed in the existence of heroes like Odysseus, who were often considered to be semi-divine or favored by the gods. While Odysseus is a central figure in Greek mythology and literature, there is no historical evidence to support his actual existence as a real person. However, the belief in such characters was strong in ancient Greek culture, and they were often thought to be based on real individuals or events, albeit heavily embellished.

Given the worldview and beliefs of people in the historical period of the work, Odysseus would be considered an invented character whose existence is not probable, as he embodies traits and experiences that are typical of mythological heroes rather than historical figures. Therefore, according to the specified scale, Odysseus would be classified as an invented character whose existence is not probable.

Score=3","""The Odyssey"" by Homer is an ancient Greek epic poem that describes the journey of Odysseus as he attempts to return home to Ithaca after the Trojan War. The settings in ""The Odyssey"" include a mix of real geographical locations and fantastical places. 

1. Real locations: The poem references real places such as Ithaca, Troy, and various parts of the Mediterranean, which were known to exist in the ancient world.

2. Invented details: While some locations are real, the details and descriptions often include mythical elements, such as the land of the Lotus-Eaters or the island of the Cyclopes, which are not documented to exist in reality.

3. Invented locations: Many of the settings, like the island of Circe or the realm of the dead, are entirely invented and involve mythical creatures and gods, which were part of the belief system of the time.

4. Probability and possibility: In the context of ancient Greek beliefs, the existence of such mythical places was considered possible, as the Greeks believed in gods and mythical creatures influencing the world. However, from a modern perspective, these locations would require violations of natural laws.

Considering the worldview and beliefs of people in the historical period of the work, the settings in ""The Odyssey"" would be seen as invented locations whose existence is not probable but still within the realm of possibility due to the cultural acceptance of myth and legend. Therefore, the score reflects the ancient perspective rather than modern standards.

Score=3","""The Odyssey"" by Homer is an epic poem that recounts the adventures of Odysseus as he attempts to return home from the Trojan War. The narrative includes a mix of actual historical elements, such as the Trojan War itself, which is believed to have some basis in historical events, and a significant amount of mythological and fantastical elements, such as encounters with gods, monsters, and magical phenomena.

In evaluating the degree of invention, probability, and possibility according to the worldview and beliefs of people in the historical period of the work, it is important to consider that the ancient Greeks believed in the existence of gods and mythical creatures, and these elements were integral to their understanding of the world. However, from a historical perspective, many of the specific events described in ""The Odyssey,"" such as Odysseus's encounters with the Cyclops, Circe, and the Sirens, are not probable or possible within the framework of real-world events, even by ancient standards.

Therefore, while the setting and some elements may have a basis in historical reality, the specific events of Odysseus's journey involve frequent and extreme violations of the laws of the real world, as understood even in the context of ancient Greek beliefs.

Score=5",3,5,3,11
"Hamlet","William Shakespeare",1600,"England","Hamlet by William Shakespeare written in 1600","In William Shakespeare's ""Hamlet,"" the main protagonist is Prince Hamlet of Denmark. The character of Hamlet is an invented one, as there is no historical evidence to suggest that he was a real person. However, the character is based on legends and historical tales, such as the story of Amleth from the ""Gesta Danorum"" by Saxo Grammaticus, which was a source for Shakespeare. In the context of the early 17th century, when the play was written, the existence of a prince like Hamlet could be considered probable, as the play is set in a royal court and deals with themes of power, revenge, and family dynamics that were relevant and plausible in the historical context of the time. Therefore, Hamlet's existence as a character is not improbable, but rather a fictional creation grounded in the social and political realities of the period. Score=2","In ""Hamlet"" by William Shakespeare, the primary setting is Elsinore Castle in Denmark. During the time the play was written, Denmark was a well-known and real geographical location. Elsinore, or Helsingør, is a real town in Denmark, and Kronborg Castle, which is often associated with Elsinore Castle, is a real castle that existed during Shakespeare's time. The setting does not involve any invented locations or require any violations of the laws of the real world. Therefore, based on the criteria provided, the setting of ""Hamlet"" aligns with real geographical locations known or documented to exist. Score=0","In evaluating the events of ""Hamlet"" by William Shakespeare, we must consider the worldview and beliefs of people in the early 17th century. The play involves a mix of courtly intrigue, murder, and supernatural elements, such as the appearance of King Hamlet's ghost. 

During the Elizabethan era, belief in ghosts and the supernatural was common, and the idea that a ghost could appear to deliver a message or seek revenge was within the realm of possibility for people of that time. The political intrigue and murder within a royal family, while dramatic, are plausible events that could occur in any historical period. 

However, the presence of the ghost and its role in the narrative introduces an element that, while believable to contemporary audiences, involves a soft violation of the laws of the real world as understood today. Given the historical context, the ghost's appearance would be seen as possible, though not probable, by the standards of the time.

Therefore, considering the historical beliefs and the nature of the events, the play's events are best categorized as invented historical events whose occurrence is not probable, but possible within the worldview of the period.

Score=3",2,3,0,5
"Moby-Dick","Herman Melville",1851,"United States","Moby-Dick by Herman Melville written in 1851","""Moby-Dick"" by Herman Melville features several main protagonists, including Ishmael, Captain Ahab, and the titular whale, Moby Dick. 

1. Ishmael: He is the narrator and a sailor on the whaling ship, the Pequod. Ishmael is a fictional character, but his existence is probable within the context of the 19th-century whaling industry. Many individuals like him would have existed, making him an invented character whose existence is probable. 

2. Captain Ahab: He is the monomaniacal captain of the Pequod, obsessed with hunting Moby Dick. While Ahab is a fictional character, captains with similar traits and obsessions could have existed in the whaling industry of the time. Thus, his existence is also probable.

3. Moby Dick: The white whale is a central character in the novel. While albino whales do exist, Moby Dick's characterization as a near-mythical creature with almost supernatural attributes makes his existence less probable. However, within the 19th-century worldview, such a creature could be seen as possible, albeit unlikely.

Considering the historical context and the nature of the characters, the main protagonists of ""Moby-Dick"" fall into the category of invented characters whose existence is probable. 

Score=2","""Moby-Dick"" by Herman Melville is set in real geographical locations, primarily focusing on the seas and oceans, particularly the Pacific Ocean, as well as specific ports and islands that were known and documented to exist during the 19th century. The novel includes detailed descriptions of whaling voyages and maritime life, which were based on Melville's own experiences and the whaling industry of the time. While there are some embellishments and dramatic elements in the narrative, the settings themselves are grounded in reality and reflect the geographical knowledge of the period. Therefore, the work should be evaluated as having real geographical locations, known or documented to exist. Score=0","""Moby-Dick"" by Herman Melville is a novel that blends actual historical events with fictional elements. The central event of the novel is Captain Ahab's obsessive pursuit of the white whale, Moby Dick. Whaling was indeed a significant industry in the 19th century, and the novel accurately depicts many aspects of whaling life and practices of the time. However, the specific events surrounding the hunt for Moby Dick, particularly the whale's almost supernatural characteristics and Ahab's monomaniacal quest, are fictionalized and dramatized for narrative effect.

In the context of the 19th-century worldview, while whaling expeditions and encounters with large whales were common, the specific events of a single whale being pursued with such personal vendetta and the whale's almost mythical status would be seen as improbable. The novel does not require violations of the laws of the real world, but it does stretch the probability of such events occurring as described.

Therefore, considering the historical context and the blend of real and fictional elements, the events in ""Moby-Dick"" can be categorized as invented historical events whose occurrence is not probable. 

Score=3",2,3,0,5
"Pride and Prejudice","Jane Austen",1813,"United Kingdom","Pride and Prejudice by Jane Austen written in 1813","""Pride and Prejudice"" by Jane Austen, written in 1813, features characters that are entirely invented by the author. However, these characters are crafted with a high degree of realism and are representative of the social classes and norms of early 19th-century England. The main protagonists, such as Elizabeth Bennet and Mr. Darcy, are fictional but are portrayed in a manner that makes their existence highly probable within the context of the time period. They embody the characteristics, behaviors, and societal roles that were typical of the English gentry and middle class during the Regency era. Therefore, while they are not real historical figures, their existence is plausible and aligns with the worldview and beliefs of people in that historical period. 

Score=2","""Pride and Prejudice"" by Jane Austen is set in early 19th-century England, primarily in rural areas such as Hertfordshire, Derbyshire, and Kent. These are real geographical locations known to exist, and the novel does not introduce any invented details that alter their fundamental nature. The settings are depicted with a high degree of realism, reflecting the social and cultural context of the time. Therefore, based on the criteria provided, the settings in ""Pride and Prejudice"" align with real geographical locations, known or documented to exist. Score=0","""Pride and Prejudice"" by Jane Austen is a novel set in the early 19th century, focusing on the lives and relationships of the British gentry. The events depicted in the novel, such as social gatherings, courtship, and marriage, are reflective of the societal norms and practices of the time. These events are based on actual historical practices and customs, with some artistic embellishments for narrative purposes. Given that the novel portrays realistic social interactions and events that were common and plausible in the early 1800s, it aligns with actual historical events with invented details for dramatic effect. Therefore, the degree of invention is minimal, and the events are highly probable within the context of the period.

Score=1",2,1,0,3
