"Title","Author.Creator","Year","Region","to_annotate","annotation_characters","annotation_settings","annotation_events","score_characters","score_events","score_settings","fictionility"
"The Divine Comedy","Dante Alighieri",1320,"Italy","The Divine Comedy by Dante Alighieri written in 1320","The main protagonists of ""The Divine Comedy"" by Dante Alighieri are Dante himself and the Roman poet Virgil. Dante, the author, is a real historical figure, and Virgil was a real poet from ancient Rome. However, in the context of the narrative, both characters undertake a journey through the realms of the afterlife—Inferno, Purgatorio, and Paradiso—which involves interactions with various mythological and allegorical figures. 

From the perspective of the 14th-century worldview, the existence of Dante and Virgil as historical figures is real, but their journey through the afterlife is a fictional construct. The narrative requires a belief in the afterlife and the possibility of such a journey, which aligns with the religious and cultural beliefs of the time. However, the specific interactions and the journey itself are not probable in a literal sense, as they involve supernatural elements and allegorical representations.

Therefore, considering the historical context and the nature of the characters' journey, the main protagonists fall under the category of ""Invented characters whose existence is not probable,"" as their journey involves elements that are beyond the natural world but are not entirely impossible within the belief system of the period.

Score=3","The Divine Comedy by Dante Alighieri is a literary work that describes an allegorical journey through the realms of the afterlife: Inferno (Hell), Purgatorio (Purgatory), and Paradiso (Paradise). These settings are entirely invented and are based on the theological and cosmological views of the medieval period. During Dante's time, the existence of such realms was a matter of religious belief rather than empirical evidence. The locations are depicted with vivid and imaginative details that align with the spiritual and moral framework of the era. However, from a geographical and physical standpoint, these realms require significant violations of the natural laws as understood even in the medieval worldview, as they are metaphysical rather than physical places. Therefore, the settings in The Divine Comedy are invented locations whose existence is not possible because they require frequent or extreme violations of the laws of the real world. Score=5","""The Divine Comedy"" by Dante Alighieri is a narrative poem that describes the journey of the protagonist, Dante, through the realms of the afterlife: Hell (Inferno), Purgatory (Purgatorio), and Paradise (Paradiso). The work is deeply rooted in the medieval Christian worldview and reflects the beliefs and theological concepts of the time, such as the existence of an afterlife, divine justice, and the moral structure of the universe.

From the perspective of people in the historical period when Dante wrote the poem, the events described in ""The Divine Comedy"" were not considered actual historical events. Instead, they were allegorical and theological representations of spiritual truths and moral lessons. The journey through the afterlife, encounters with historical and mythological figures, and the detailed descriptions of the various circles of Hell, terraces of Purgatory, and spheres of Heaven are all invented events.

While the existence of an afterlife was a widely held belief, the specific events and structure of the afterlife as depicted by Dante involve imaginative and allegorical elements that go beyond the literal beliefs of the time. Therefore, these events are not considered probable occurrences within the historical context.

Given that the work involves a journey through realms that are not part of the physical world and includes supernatural elements, it requires some violations of the laws of the real world as understood in the medieval period. However, these violations are not extreme, as they align with the theological and philosophical ideas of the time.

Score=4",3,4,5,12
"Le Morte d’Arthur","Sir Thomas Malory",1485,"England","Le Morte d’Arthur by Sir Thomas Malory written in 1485","""Le Morte d’Arthur"" by Sir Thomas Malory is a compilation and reinterpretation of the legendary tales of King Arthur, his knights, and the Round Table. The main protagonists, such as King Arthur, Sir Lancelot, and Merlin, are based on a mix of historical figures, myth, and folklore. 

1. King Arthur: While there may have been a historical figure or figures that inspired the legend of King Arthur, the character as depicted in Malory's work is heavily fictionalized with numerous legendary and mythical elements.
2. Sir Lancelot: Lancelot is a character primarily from Arthurian romance literature and does not have a historical basis, making his existence improbable.
3. Merlin: As a wizard with magical powers, Merlin's existence is not possible according to the worldview of the time, which did not support the existence of magic as depicted in the tales.

Considering the historical period of the work, the characters are largely seen as legendary and not historical, with elements of magic and myth that were accepted in the context of medieval literature. Therefore, the main protagonists are invented characters whose existence is not probable or possible due to the mythical and magical elements involved.

Score=4","""Le Morte d’Arthur"" by Sir Thomas Malory is a compilation of Arthurian legends, which are set in a mix of real and fictional locations. The work includes real geographical locations such as England and France, but it also features invented places like Camelot and Avalon. These invented locations are deeply rooted in medieval mythology and legend.

From the perspective of people in the historical period when Malory wrote the work (the late 15th century), the existence of places like Camelot and Avalon might have been seen as possible or probable within the context of the legendary and mythical framework. However, these locations are not documented to exist in reality and are primarily products of medieval imagination and storytelling.

Given the blend of real locations with invented ones that are not probable but are part of the legendary tradition, the work would be evaluated as having invented locations whose existence is not probable. 

Score=3","""Le Morte d’Arthur"" by Sir Thomas Malory is a compilation and reinterpretation of Arthurian legends, which are a mix of folklore, literary invention, and some historical elements. The work is set in a legendary version of Britain and involves characters like King Arthur, Merlin, and the Knights of the Round Table. 

The events described in ""Le Morte d’Arthur"" include the rise and fall of King Arthur, the quest for the Holy Grail, and various battles and adventures of the knights. While there may be some historical basis for a leader like Arthur in post-Roman Britain, the specific events and characters in Malory's work are largely invented and rooted in medieval romance traditions.

From the perspective of people in the 15th century, the existence of a legendary king like Arthur might have been seen as plausible, but the specific events, such as the magical elements involving Merlin or the quest for the Holy Grail, would have been understood as fictional or allegorical. Therefore, the events in ""Le Morte d’Arthur"" are invented historical events whose occurrence is not probable, as they involve elements of magic and myth that go beyond the historical record and the probable.

Score=3",4,3,3,10
"Don Quixote","Miguel de Cervantes",1605,"Spain","Don Quixote by Miguel de Cervantes written in 1605","""Don Quixote"" by Miguel de Cervantes is a seminal work in Western literature, featuring the main protagonist, Don Quixote, and his squire, Sancho Panza. The characters are entirely fictional, yet they are crafted with a high degree of realism and psychological depth. 

Don Quixote is a nobleman who becomes a self-styled knight-errant, driven by his obsession with chivalric romances. His character, while fictional, is plausible within the context of the early 17th century, as he represents a satirical take on the fading ideals of knighthood and the impact of literature on the imagination. Sancho Panza, his loyal squire, is also a fictional character, but his existence is probable as he embodies the common man of the time, providing a counterbalance to Don Quixote's idealism with his practicality and earthy wisdom.

Considering the worldview and beliefs of people in the historical period of the work, both characters are invented but their existence is probable. They are exaggerated for comedic and satirical effect, but they do not require any violations of the laws of the real world to exist.

Score=2","""Don Quixote"" by Miguel de Cervantes is set in various locations across Spain, primarily in the region of La Mancha. The geographical settings in the novel are based on real locations that existed during the time Cervantes wrote the book. While Cervantes may have added fictional details to enhance the narrative, the locations themselves are grounded in reality and were known to the people of the early 17th century. Therefore, the settings do not involve any invented locations or require any violations of the laws of the real world according to the beliefs and worldview of that historical period. 

Score=0","""Don Quixote"" by Miguel de Cervantes is a satirical novel that explores the adventures of a man who believes himself to be a knight-errant. The events in the novel are largely invented and serve to parody the chivalric romances popular during Cervantes' time. While the setting and some social customs reflect the real world of 16th and 17th century Spain, the specific events, such as tilting at windmills and mistaking inns for castles, are exaggerated and improbable within the context of the period's worldview. These events are not possible in the sense that they require a character to consistently misinterpret reality in a way that defies common sense, but they do not involve violations of the physical laws of the real world. Therefore, the events are best categorized as invented historical events whose occurrence is not probable. 

Score=3",2,3,0,5
"The Adventures of Tom Sawyer","Mark Twain",1876,"United States","The Adventures of Tom Sawyer by Mark Twain written in 1876","""The Adventures of Tom Sawyer"" by Mark Twain is a novel featuring characters that are primarily invented by the author. The main protagonist, Tom Sawyer, is a fictional character, as are his friends Huck Finn and Becky Thatcher. These characters are not based on real individuals, but they are crafted to be believable and representative of children living in a small town along the Mississippi River during the mid-19th century. Their existence is probable within the context of the time period and setting, as they embody the traits and behaviors typical of children in that era. Therefore, according to the scale provided, the characters fall under the category of invented characters whose existence is probable. Score=2","""The Adventures of Tom Sawyer"" by Mark Twain is set in the fictional town of St. Petersburg, Missouri, which is based on the real town of Hannibal, Missouri, where Twain grew up. The geographical setting is largely realistic, with the Mississippi River playing a significant role in the story. The town and its surroundings are depicted with a high degree of realism, reflecting the actual environment of a small American town in the mid-19th century. While some details may be embellished for narrative purposes, the setting is grounded in real geographical locations known to exist at the time. Therefore, the work falls into the category of real geographical locations with invented details. Score=1","""The Adventures of Tom Sawyer"" by Mark Twain is a novel set in the mid-19th century in the fictional town of St. Petersburg, Missouri. The events in the book are largely based on the everyday life and adventures of a young boy, Tom Sawyer, and his friends. While the novel captures the essence of childhood and small-town life during that period, the specific events, such as Tom and Huck witnessing a murder in a graveyard, finding treasure, and getting lost in a cave, are fictional and crafted for entertainment.

These events are not documented historical occurrences, but they are plausible within the context of the time period and setting. The adventures are typical of the imaginative play and mischief that children might engage in, making them probable in the sense that they could have happened, even if they did not. Therefore, the events in the novel can be classified as invented historical events whose occurrence is probable.

Score=2",2,2,1,5
"Les Misérables","Victor Hugo",1862,"France","Les Misérables by Victor Hugo written in 1862","""Les Misérables"" by Victor Hugo is a novel set in early 19th-century France, featuring characters that are entirely fictional but crafted with a high degree of realism. The main protagonists, such as Jean Valjean, Javert, Fantine, and Cosette, are invented characters. However, their existence is probable within the context of the historical and social setting of the time. Hugo's characters are deeply rooted in the social issues and human conditions of the period, making them plausible representations of people who could have existed in that era. Therefore, according to the worldview and beliefs of people in the historical period of the work, the characters are invented but their existence is probable. Score=2","""Les Misérables"" by Victor Hugo is set in real geographical locations in France, primarily in Paris and its surrounding areas, during the early 19th century. The novel meticulously describes these settings with great attention to historical and social details, reflecting the realities of the time. Hugo's depiction of Paris, including specific neighborhoods, streets, and landmarks, aligns with the actual geography and urban landscape of the period. Therefore, the settings in ""Les Misérables"" are based on real locations known to exist, without any invented details that would alter their fundamental reality. 

Score=0","""Les Misérables"" by Victor Hugo is a novel set in early 19th-century France, primarily during the years following the Napoleonic Wars and leading up to the June Rebellion of 1832. The work is deeply rooted in the social and political context of the time, and many of the events depicted are based on actual historical occurrences, such as the Battle of Waterloo and the aforementioned June Rebellion. However, Hugo embellishes these events with fictional details and characters to serve his narrative and thematic purposes.

The June Rebellion, for instance, is a real historical event, but the specific actions and outcomes involving the characters in the novel are invented. The novel's depiction of the social conditions, such as poverty and the justice system, reflects real issues of the time, though dramatized for literary effect.

Considering the criteria, the events in ""Les Misérables"" are actual historical events with invented details, aligning with the worldview and beliefs of people in the historical period of the work. Therefore, the appropriate score is:

Score=1",2,1,0,3
"One Hundred Years of Solitude","Gabriel García Márquez",1967,"Colombia","One Hundred Years of Solitude by Gabriel García Márquez written in 1967","""One Hundred Years of Solitude"" by Gabriel García Márquez is a seminal work of magical realism, a genre that blends the real with the fantastical. The main protagonists of the novel are the members of the Buendía family, whose lives are chronicled over several generations in the fictional town of Macondo. 

The characters in the novel, such as José Arcadio Buendía, Úrsula Iguarán, and their descendants, are entirely invented by the author. While they are portrayed with rich, complex personalities and lifelike details, their existence is not probable in the real world. This is because the novel incorporates elements of magical realism, where fantastical events and characteristics are accepted as part of everyday life. For example, characters experience extraordinary events, such as ascensions to heaven and living for over a century, which are not possible in the real world.

However, these characters are not entirely impossible within the context of the novel's setting and the worldview of the characters themselves. The magical elements are seamlessly integrated into the narrative, reflecting the beliefs and cultural context of the fictional world. Therefore, while the characters are not probable in a realistic sense, they do not require extreme violations of the laws of the real world, as they are consistent with the novel's internal logic and the magical realism genre.

Considering the historical and cultural context of the novel, the characters' existence is not probable but is accepted within the framework of the story's magical realism. Thus, they fall into the category of invented characters whose existence is not probable. 

Score=3","""One Hundred Years of Solitude"" by Gabriel García Márquez is set in the fictional town of Macondo. The town is a central element of the novel and is depicted with a rich blend of magical realism, a style that combines realistic narrative with fantastical elements. Macondo is portrayed as a remote, isolated village in Colombia, which aligns with real geographical locations in Latin America. However, the details of Macondo and its surroundings are heavily invented, incorporating elements that are improbable or impossible according to the laws of the real world, such as the presence of magical events and surreal occurrences.

Considering the historical period of the work, the 20th century, and the worldview of people at that time, the setting of Macondo would be seen as an invented location whose existence is not possible due to the frequent and extreme violations of the laws of the real world, such as the magical occurrences that are integral to the story. Therefore, the setting of Macondo in ""One Hundred Years of Solitude"" would be evaluated as:

Score=5","""One Hundred Years of Solitude"" by Gabriel García Márquez is a seminal work of magical realism, a genre that blends fantastical elements with realistic settings and events. The novel chronicles the multi-generational story of the Buendía family in the fictional town of Macondo. While the narrative is deeply rooted in the historical and cultural context of Latin America, it incorporates numerous fantastical events that defy the laws of the real world.

The events in the novel include characters living for over a century, ghosts interacting with the living, and rain lasting for years, among others. These elements are not possible within the framework of the real world, even when considering the beliefs and worldviews of the historical period depicted in the novel. The magical elements are integral to the narrative and are presented as part of the everyday reality of the characters, which is a hallmark of magical realism.

Given the frequent and extreme violations of the laws of the real world required for these events to occur, the work falls into the category of invented historical events whose occurrence is not possible. Therefore, based on the specified scale, the appropriate score for ""One Hundred Years of Solitude"" is:

Score=5",3,5,5,13
"Voyage dans la lune","Cyrano de Bergerac",NA,"","Voyage dans la lune by Cyrano de Bergerac written in NA","""Voyage dans la lune"" by Cyrano de Bergerac is a work of early science fiction written in the 17th century. The main protagonist is a fictionalized version of Cyrano himself, who embarks on a fantastical journey to the moon. In the context of the 17th century, the idea of traveling to the moon was purely speculative and imaginative, as it involved concepts and technologies that were not possible at the time. The character's journey involves fantastical elements such as flying machines and encounters with lunar inhabitants, which would have been seen as highly improbable or impossible by the standards of that era. Therefore, the protagonist's existence and experiences require frequent or extreme violations of the laws of the real world as understood in the 17th century. Score=5","""Voyage dans la lune"" by Cyrano de Bergerac, written in the 17th century, is a work that explores the idea of traveling to the moon. During this period, the moon was a subject of fascination and speculation, but it was not yet understood in the way it is today. The concept of traveling to the moon involved significant imaginative leaps, as the technology and scientific understanding required for such a journey were not available at the time.

In the context of the 17th century, the moon was a real celestial body, but the details of life and landscapes described by Cyrano de Bergerac were entirely invented. The existence of such a location, with its fantastical elements, was not probable according to the scientific knowledge of the time. However, the idea of the moon as a place one could visit did not require extreme violations of the laws of the real world as understood then, since the laws of physics and space travel were not yet fully developed.

Therefore, considering the historical context and the imaginative nature of the setting, the work would be evaluated as an invented location whose existence is not possible because it requires few or soft violations of the laws of the real world as understood in the 17th century.

Score=4","""Voyage dans la lune"" by Cyrano de Bergerac, written in the 17th century, is a work of proto-science fiction that describes a journey to the moon. During the time it was written, the concept of space travel was purely speculative and imaginative. The narrative includes fantastical elements such as flying machines and lunar inhabitants, which were not grounded in the scientific understanding of the period. While the idea of traveling to the moon might have been a topic of curiosity and speculation, the methods and events described in the work involve significant violations of the known laws of physics and technology of the 17th century. Therefore, the events in the book are not possible according to the worldview and beliefs of people in that historical period. 

Score=5",5,5,4,14
"The Lusiads","Luís de Camões",1572,"Portugal","The Lusiads by Luís de Camões written in 1572","""The Lusiads"" by Luís de Camões is an epic poem that primarily focuses on the real historical figure Vasco da Gama and his voyage to India. Vasco da Gama was a well-documented explorer from the Age of Discovery, and his journey is a significant historical event. The poem, however, embellishes his story with mythological elements and divine interventions, which were common literary devices of the time. Despite these embellishments, the main protagonist, Vasco da Gama, is a real character known to have existed. Therefore, according to the scale provided, the main protagonist falls under the category of real characters, known or documented to have existed. Score=0","""The Lusiads"" by Luís de Camões is an epic poem that primarily recounts the voyages of Portuguese explorer Vasco da Gama, focusing on his journey to India. The settings in the poem include real geographical locations such as Lisbon, the Cape of Good Hope, and Calicut, which were known and documented to exist during the time the poem was written. However, the poem also includes mythological and fantastical elements, such as the Island of Love, which is an invented location that requires some suspension of disbelief and soft violations of the real world's laws. Given the historical context of the 16th century, when exploration was expanding the known world, the inclusion of such fantastical elements would have been seen as a creative embellishment rather than a literal geographical claim. Therefore, the settings in ""The Lusiads"" can be evaluated as real geographical locations with invented details and some mythological embellishments. Score=1","""The Lusiads"" by Luís de Camões is an epic poem that primarily recounts the Portuguese voyages of discovery during the Age of Exploration, focusing on Vasco da Gama's journey to India. The work blends historical events with mythological and fantastical elements. 

From the perspective of the 16th-century worldview, the actual voyage of Vasco da Gama is a documented historical event. However, Camões embellishes this narrative with invented details, such as the intervention of classical gods and fantastical occurrences, which were not part of the historical record but were consistent with the literary and cultural norms of the time. 

Given the context of the period, the inclusion of mythological elements would have been seen as a poetic device rather than a literal account. Therefore, while the core event (the voyage) is historical, the embellishments are invented and improbable according to the beliefs of the time, but not impossible, as they align with the mythological understanding of the world.

Score=1",0,1,1,2
