"Title","Author.Creator","Year","Region","to_annotate","annotation_characters","annotation_events","annotation_settings","score_characters","score_events","score_settings"
"The Bible","Various",100,"Middle East","The Bible by Various written in 100","The Bible, a collection of religious texts, contains a wide range of characters, from historical figures to mythical beings. Evaluating the main characters based on the specified referent, we find a mix of real historical figures, such as kings and prophets, alongside characters whose existence is more symbolic or allegorical, such as Adam and Eve, and supernatural beings like angels and God. Given the context of the time, many characters are presented as real or could have been perceived as real by contemporary audiences, but others, especially those with supernatural attributes, fall into the realm of myth and allegory. Therefore, the main characters in the Bible span a range from real to those that could not have existed. However, considering the overall narrative and the presence of divine and mythical elements, the characters often lean towards the improbable or impossible in terms of existence. Score=3","Evaluating the Bible, particularly focusing on the events described within it, requires considering the standards and context of the time it was written. The Bible is a collection of texts that include historical narratives, poetry, prophecy, and law, among other genres. Some events described in the Bible, such as the reigns of certain kings or battles, have historical corroboration or are plausible within the historical context of the ancient Near East. However, other events, such as the creation story in Genesis, the parting of the Red Sea, or the resurrection of Jesus, are considered by many scholars to be theological or mythological in nature rather than historical.

Given the blend of historical and theological narratives, and considering the standards of the time when these texts were written, many of the events described could be seen as invented historical events whose occurrence is improbable, especially when viewed through a modern historical and scientific lens. Therefore, for the purpose of this evaluation, the events in the Bible can be categorized as invented historical events whose occurrence is improbable.

Score=3","The Bible, as a collection of texts written over centuries, contains a variety of settings that range from real geographical locations to more fantastical ones. Many of the locations mentioned, such as Jerusalem, Egypt, and Babylon, are real geographical places that existed and continue to exist. However, the Bible also includes settings that are more symbolic or mythical in nature, such as the Garden of Eden or the city of Nineveh as described in the story of Jonah, which may include invented details or elements that are not historically verifiable.

Given the context of the time, many of the locations in the Bible were understood to be real or based on real places, even if some details were embellished or symbolic. Therefore, the settings in the Bible often fall into the category of real geographical locations with invented details, reflecting both historical and theological narratives.

Score=1",3,3,1
"The Epic of Gilgamesh","Anonymous",-2100,"Mesopotamia","The Epic of Gilgamesh by Anonymous written in -2100","The Epic of Gilgamesh is an ancient Mesopotamian poem that features a mix of real and mythical elements. The main character, Gilgamesh, is based on a historical figure, a king of Uruk, who likely existed around 2700 BCE. However, the narrative embellishes his life with fantastical adventures and divine interactions, such as his friendship with the wild man Enkidu, encounters with gods and goddesses, and a quest for immortality. These elements suggest that while Gilgamesh may have been a real person, the details of his story are largely fictionalized and mythologized. Given the standards and context of the time, where myth and history were often intertwined, the main characters can be seen as invented characters who could have existed, albeit with significant mythological embellishments. Score=2","The Epic of Gilgamesh is an ancient Mesopotamian poem that is considered one of the earliest works of literary fiction. It recounts the adventures of Gilgamesh, a historical king of Uruk, and his companion Enkidu. While Gilgamesh was indeed a historical figure, the events described in the epic, such as battling mythical creatures like Humbaba and the Bull of Heaven, and the quest for immortality, are largely mythological and symbolic in nature. These events are not grounded in historical fact and are instead part of the mythological tradition of the time, intended to convey moral and philosophical lessons rather than historical accounts. Given the context and standards of the time, these events are best categorized as invented historical events whose occurrence is improbable. Score=3","The Epic of Gilgamesh is an ancient Mesopotamian text that features a mix of real geographical locations and mythological elements. The city of Uruk, where much of the story takes place, is a real historical city that existed in ancient Sumer, which corresponds to modern-day Iraq. Other locations mentioned, such as the Cedar Forest and the abode of the gods, are more mythological in nature. The Cedar Forest, for instance, is based on real cedar forests in the region but is imbued with fantastical elements, such as being guarded by the demon Humbaba. Given the blend of real locations with invented details and mythological settings, the work fits well into the category of real geographical locations with invented details. Score=1",2,3,1
"Harry Potter (series)","J.K. Rowling",1997,"United Kingdom","Harry Potter (series) by J.K. Rowling written in 1997","The main characters in the ""Harry Potter"" series by J.K. Rowling include Harry Potter, Hermione Granger, and Ron Weasley, among others. These characters are invented and exist within a magical world that includes elements such as wizards, witches, and magical creatures. While they are portrayed with human emotions and experiences that readers can relate to, their existence is tied to a fantastical setting that includes magic, which is not possible in the real world. Therefore, the main characters are invented characters that could not have existed in reality, especially considering the standards and context of the time when the series was written. Score=4","The Harry Potter series by J.K. Rowling is a work of fantasy fiction that features a world where magic exists, and wizards and witches live alongside non-magical people (Muggles). The series includes events such as attending a magical school (Hogwarts), using wands to cast spells, and interacting with magical creatures. These events are clearly invented and involve elements of magic that do not exist in the real world. Given the context of the time and the genre, these events are not intended to be taken as historical or plausible within our reality. Therefore, the events in the Harry Potter series are best categorized as invented historical events that could not have occurred. Score=4","The ""Harry Potter"" series by J.K. Rowling is set in a mix of real and invented locations. The series features real geographical locations such as London and King's Cross Station, which are integral to the story. However, it also includes invented locations like Hogwarts School of Witchcraft and Wizardry, Diagon Alley, and Hogsmeade. These invented locations are crafted with a level of detail that makes them feel plausible within the context of the magical world, yet they are clearly fantastical and do not exist in reality. Given the blend of real locations with detailed, imaginative settings that are improbable in the real world, the series fits well into the category of ""Invented locations whose existence is improbable."" Score=3",4,4,3
"Sapiens: A Brief History of Humankind","Yuval Noah Harari",2011,"Israel","Sapiens: A Brief History of Humankind by Yuval Noah Harari written in 2011","""Sapiens: A Brief History of Humankind"" by Yuval Noah Harari is a non-fiction book that explores the history and development of Homo sapiens. The main characters in this work are not individual people but rather the species Homo sapiens as a whole, along with other human species like Neanderthals. These are real entities based on scientific and historical evidence. Harari discusses real historical figures and events, but the focus is on the broader narrative of human evolution and societal development. Therefore, the main ""characters"" in the context of this book are real and based on factual information. 

Score=0","""Sapiens: A Brief History of Humankind"" by Yuval Noah Harari is a non-fiction book that explores the history of Homo sapiens from the emergence of archaic human species to the present. The book is known for its broad and sweeping narrative that combines history, anthropology, and sociology. 

When evaluating the events described in ""Sapiens,"" particularly in the context of the specified referent, Harari often discusses actual historical events but sometimes adds speculative elements to illustrate broader points or to engage the reader's imagination. For example, he discusses the Cognitive Revolution, the Agricultural Revolution, and the unification of humankind through imagined scenarios and hypothetical situations that could have occurred, but are not documented historical events.

Given this approach, the events in ""Sapiens"" often fall into the category of invented historical events that could have occurred, as Harari uses plausible scenarios to explain complex historical processes. Therefore, the appropriate score for the events in ""Sapiens,"" considering the standards and context of the time, is:

Score=2","""Sapiens: A Brief History of Humankind"" by Yuval Noah Harari is a non-fiction book that explores the history and development of Homo sapiens. The book primarily discusses real historical events, locations, and developments, although it sometimes speculates on hypothetical scenarios or future possibilities. However, when it comes to the geographical settings discussed in the book, they are based on real locations and historical contexts. Harari examines the evolution of humans across various continents and the development of societies in real geographical settings, such as the Fertile Crescent, the Roman Empire, and modern nation-states. Therefore, the settings in ""Sapiens"" are real geographical locations with historical accuracy, without invented details that would alter their existence. 

Score=0",0,2,0
"Shark Attack (film series)","Various (first film by Bob Misiorowski)",1999,"United States","Shark Attack (film series) by Various (first film by Bob Misiorowski) written in 1999","The ""Shark Attack"" film series, beginning with the first film directed by Bob Misiorowski in 1999, features characters that are primarily invented for the purpose of the narrative. These characters are typically scientists, divers, and other individuals who find themselves embroiled in shark-related incidents. While the characters are fictional, they are designed to be plausible within the context of the story, as they represent archetypes that could exist in real life, such as marine biologists or adventurers. However, the situations they find themselves in, and sometimes their exaggerated characteristics, push them slightly towards the improbable side. Given the context of the late 1990s, when such adventure and thriller films often featured larger-than-life characters, the characters in ""Shark Attack"" are best categorized as invented characters who could have existed, albeit with some dramatic embellishments typical of the genre. Score=2","The ""Shark Attack"" film series, starting with the first film directed by Bob Misiorowski in 1999, primarily revolves around the premise of aggressive and often mutated sharks attacking humans. While shark attacks are real events that occur in nature, the series often exaggerates these events with elements such as genetically altered sharks or sharks behaving in ways that are not typical of their species. These embellishments and the portrayal of sharks as consistently aggressive towards humans are improbable based on actual shark behavior and scientific understanding. Therefore, the events depicted in the series are invented historical events whose occurrence is improbable. Score=3","The ""Shark Attack"" film series, starting with the first film directed by Bob Misiorowski in 1999, primarily takes place in real geographical locations, such as coastal areas where shark attacks are plausible. However, the series often embellishes these settings with fictional details to enhance the drama and horror elements, such as exaggerated shark behavior or fictionalized towns and research facilities. These invented details are designed to fit within the framework of real-world locations, making them plausible within the context of the film's narrative. Given the standards and context of the time, where films often blend real settings with fictional elements for entertainment purposes, the settings in ""Shark Attack"" can be evaluated as real geographical locations with invented details. Score=1",2,3,1
"1984","George Orwell",1949,"United Kingdom","1984 by George Orwell written in 1949","In George Orwell's ""1984,"" the main characters are primarily invented, but they are crafted in a way that they could have existed within the context of the novel's dystopian setting. The protagonist, Winston Smith, and other characters like Julia and O'Brien are fictional, yet they are portrayed as ordinary individuals living under a totalitarian regime. The characters' behaviors, motivations, and experiences are plausible within the oppressive society Orwell describes, reflecting the potential realities of life under such a regime. Given the standards and context of the time when Orwell wrote the novel, these characters are believable as they embody the fears and concerns of a post-World War II world facing the rise of totalitarian states. Therefore, the characters fall into the category of ""Invented characters who could have existed."" Score=2","In evaluating the events of George Orwell's ""1984"" based on the specified referent, we must consider the context of the time when it was written in 1949. The novel presents a dystopian future where a totalitarian regime exercises extreme control over every aspect of life, including thought and history. While the specific events and the world of ""1984"" are invented, they are rooted in Orwell's observations of totalitarian regimes of his time, such as Nazi Germany and Stalinist Soviet Union. The events could be seen as a plausible extension of these regimes' practices, making them invented historical events that could have occurred under certain circumstances. Therefore, the events in ""1984"" are best categorized as invented historical events that could have occurred, given the political climate and technological possibilities of the mid-20th century. Score=2","In George Orwell's ""1984,"" the setting is primarily in Airstrip One, formerly known as Great Britain, which is part of the superstate Oceania. While the geographical location of Airstrip One corresponds to a real place, the details of the setting are heavily altered to fit the dystopian narrative. The world is divided into three superstates: Oceania, Eastasia, and Eurasia, which are fictional constructs. These superstates are not only invented but also reflect a geopolitical reality that did not exist at the time of writing. However, the concept of such superstates could be seen as a plausible extension of the political tensions and alliances of the mid-20th century, particularly in the context of the Cold War. Therefore, the setting involves real geographical locations with significant invented details that could have existed under different historical circumstances. Score=1",2,2,1
"The Tale of Genji","Murasaki Shikibu",1000,"Japan","The Tale of Genji by Murasaki Shikibu written in 1000","""The Tale of Genji"" by Murasaki Shikibu, written in the early 11th century, is a classic work of Japanese literature. The main character, Hikaru Genji, is an invented character who could have existed within the context of the Heian period in Japan. The novel is a fictional narrative, but it is deeply rooted in the cultural, social, and political realities of the time. Genji is portrayed as an idealized nobleman, and his life and experiences reflect the customs and court life of the Heian era. While Genji himself is not a historical figure, his character is plausible within the historical and cultural framework of the period. Therefore, the main characters in ""The Tale of Genji"" can be classified as invented characters who could have existed. Score=2","""The Tale of Genji"" by Murasaki Shikibu is a classic work of Japanese literature from the early 11th century. It is often considered the world's first novel. The story is set in the Heian period and follows the life and romantic exploits of Hikaru Genji, the ""Shining Prince."" While the novel is deeply rooted in the cultural and social context of the Heian court, the specific events and characters are fictional. The narrative includes detailed descriptions of court life, customs, and politics, which reflect the historical setting accurately. However, the events themselves, such as Genji's romantic escapades and personal dramas, are invented for the story. Given the context of the time, these events could have occurred in a general sense, as they are plausible within the framework of Heian court life, but they are not based on actual historical events or figures. Therefore, the events in ""The Tale of Genji"" can be classified as invented historical events that could have occurred. Score=2","""The Tale of Genji"" by Murasaki Shikibu is set in the Heian period of Japan, specifically in the capital city of Heian-kyō, which is present-day Kyoto. The settings in the novel are based on real geographical locations of the time, such as the imperial court and various aristocratic residences. However, while the locations are real, the details of the settings, including the specific residences and gardens, are often embellished or invented to serve the narrative and thematic purposes of the story. This reflects the literary style of the period, which often involved a blend of reality and artistic imagination. Therefore, the settings in ""The Tale of Genji"" can be classified as real geographical locations with invented details. Score=1",2,2,1
"The Nibelungenlied","Anonymous",1200,"Germany","The Nibelungenlied by Anonymous written in 1200","The Nibelungenlied is a medieval epic poem that features a mix of historical and legendary figures. The main characters include Siegfried, Kriemhild, and Hagen, among others. While some characters, like the Burgundian kings, have historical counterparts, the narrative embellishes their stories with mythical elements. Siegfried, for instance, is a legendary hero with superhuman abilities, such as invulnerability except for one spot on his body, which is a clear departure from historical reality. The characters are thus a blend of historical inspiration and legendary invention, making their existence improbable in the real world. Given the standards and context of the time, where myth and history often intertwined, the characters are best categorized as invented characters whose existence is improbable. Score=3","The Nibelungenlied is a medieval epic poem that blends historical elements with mythological and legendary aspects. The poem is set in a time that corresponds to the early Middle Ages and includes characters and events that are loosely based on historical figures and occurrences, such as the Burgundian kingdom and the Huns. However, the narrative is heavily embellished with fantastical elements, such as the dragon-slaying hero Siegfried and the magical cloak of invisibility. While some events and characters have a basis in history, the specific events depicted in the poem, such as Siegfried's invulnerability and the detailed interactions between the characters, are largely invented and imbued with mythological significance. Given the standards and context of the time, these events are improbable but not entirely outside the realm of medieval storytelling, which often mixed history with legend. Therefore, the events in The Nibelungenlied can be classified as invented historical events whose occurrence is improbable. Score=3","The Nibelungenlied is a medieval epic poem that primarily takes place in real geographical locations, such as the Burgundian city of Worms, the court of the Huns, and the Rhine River region. These are actual places that existed during the time the poem was written. However, the poem also includes fantastical elements and legendary embellishments, such as the dragon-slaying and the treasure of the Nibelungs, which are not tied to real geographical details. Despite these mythical aspects, the settings themselves are based on real locations with some invented details to suit the narrative. Therefore, considering the standards and context of the time, the settings in The Nibelungenlied can be evaluated as real geographical locations with invented details. Score=1",3,3,1
"The Divine Comedy","Dante Alighieri",1320,"Italy","The Divine Comedy by Dante Alighieri written in 1320","The Divine Comedy by Dante Alighieri is a narrative poem that features a mix of real historical figures and entirely fictional characters. The main character, Dante himself, is a real person, but the journey he undertakes through Hell, Purgatory, and Paradise is a fictional construct. Along the way, he encounters a variety of characters, some of whom are real historical figures (such as Virgil and Beatrice) with invented biographical details, and others who are entirely fictional or mythological (such as demons and mythological creatures).

Given the context of the time, the inclusion of real historical figures with fictionalized details was a common literary device, and the existence of mythological and allegorical characters was accepted in the narrative framework of the period. However, the journey itself and many of the characters Dante meets, especially those in the infernal and celestial realms, are invented and could not have existed in reality.

Therefore, the main characters in The Divine Comedy are a blend of real individuals with fictionalized elements and entirely fictional beings, leading to a score that reflects the presence of invented characters whose existence is improbable or impossible. Score=4","The Divine Comedy by Dante Alighieri is a narrative poem that describes the journey of the protagonist, Dante, through the realms of the afterlife: Hell (Inferno), Purgatory (Purgatorio), and Heaven (Paradiso). The work is deeply allegorical and symbolic, reflecting the religious and philosophical beliefs of the time. The events described in the poem, such as Dante's guided tour through these supernatural realms, are not based on actual historical events. Instead, they are imaginative constructs that serve to explore moral and theological themes.

Given the context of the 14th century, the afterlife was a significant aspect of religious belief, but the specific journey and encounters described by Dante are purely fictional and allegorical. They are not events that could have occurred in reality, as they involve supernatural elements and a personalized vision of the afterlife.

Therefore, the events in The Divine Comedy are best categorized as invented historical events that could not have occurred, given their supernatural and allegorical nature.

Score=4","The Divine Comedy by Dante Alighieri is a literary work that describes a journey through the realms of the afterlife: Hell (Inferno), Purgatory (Purgatorio), and Heaven (Paradiso). These settings are not based on real geographical locations but are instead imaginative constructs that serve as allegorical representations of spiritual and moral states. While Dante incorporates real historical figures and some geographical references from the known world of his time, the settings themselves are fantastical and symbolic, designed to convey theological and philosophical ideas rather than depict actual places. Given the context of the 14th century, these locations are clearly invented and could not have existed in the physical world. Therefore, the settings in The Divine Comedy align with the category of ""Invented locations that could not have existed."" Score=4",4,4,4
