"Title","Author.Creator","Year","Region","to_annotate","annotation_characters","annotation_events","annotation_settings","score_characters","score_events","score_settings"
"The Master and Margarita","Mikhail Bulgakov",1967,"Russia","The Master and Margarita by Mikhail Bulgakov written in 1967","""The Master and Margarita"" by Mikhail Bulgakov is a novel that features a blend of real and fantastical elements. The main characters include a mix of historical figures, such as Pontius Pilate, and entirely fictional ones, such as Woland (a representation of the Devil), the Master, and Margarita. The novel is set in both 1930s Moscow and ancient Jerusalem, weaving together these different timelines and characters.

The characters of the Master and Margarita, while deeply human and complex, are invented and could have existed within the context of 1930s Soviet society. However, Woland and his retinue, including characters like the talking cat Behemoth, are fantastical and could not have existed in reality. Given the presence of these supernatural elements and characters whose existence is improbable, the work leans towards the more fantastical end of the scale.

Considering the standards and context of the time, where Soviet literature often included elements of social realism, the presence of such fantastical characters would have been seen as highly imaginative and improbable. Therefore, the main characters in ""The Master and Margarita"" are best categorized as invented characters whose existence is improbable.

Score=3","""The Master and Margarita"" by Mikhail Bulgakov is a complex novel that intertwines various narratives, including a retelling of the trial of Jesus by Pontius Pilate, a love story, and a fantastical visit by the Devil to Soviet Moscow. When evaluating the historical events depicted in the novel, particularly the trial of Jesus, Bulgakov presents a narrative that is based on actual historical events but includes invented details and interpretations. The trial of Jesus is a well-documented historical event, but Bulgakov's portrayal includes fictionalized elements and characterizations that are not found in historical records. Given the context of the time, where blending historical events with fictional elements was a common literary technique, this aspect of the novel can be classified as actual historical events with invented details. Score=1","""The Master and Margarita"" by Mikhail Bulgakov is set in two primary locations: Moscow and a fantastical version of ancient Jerusalem. The Moscow setting is based on real geographical locations, with Bulgakov incorporating recognizable landmarks and streets from the city as it existed in the 1930s. However, he adds invented details, such as the presence of supernatural events and characters like Woland (the Devil) and his retinue, which blend the real with the fantastical.

The second setting, ancient Jerusalem, is depicted in the narrative of Pontius Pilate. While Jerusalem is a real historical location, Bulgakov's portrayal includes fictionalized elements and interpretations that serve the novel's themes and narrative structure.

Considering the standards and context of the time, the settings in ""The Master and Margarita"" reflect a blend of real locations with invented details, particularly in the Moscow setting, which is grounded in reality but enhanced with fantastical elements. Therefore, the appropriate score for the settings in this work is:

Score=1",3,1,1
"Slaughterhouse-Five","Kurt Vonnegut",1969,"United States","Slaughterhouse-Five by Kurt Vonnegut written in 1969","""Slaughterhouse-Five"" by Kurt Vonnegut is a novel that blends elements of science fiction with historical events. The main character, Billy Pilgrim, is a fictional character who experiences time travel and encounters with extraterrestrial beings called Tralfamadorians. While Billy Pilgrim's experiences during World War II, particularly the bombing of Dresden, are based on real historical events, his character and the science fiction elements surrounding him are invented. The existence of Billy Pilgrim as a time-traveling individual who interacts with aliens is improbable, as it incorporates fantastical elements that are not grounded in reality. Therefore, based on the scale provided, the main character of ""Slaughterhouse-Five"" falls under the category of ""Invented characters whose existence is improbable."" Score=3","In ""Slaughterhouse-Five,"" Kurt Vonnegut blends actual historical events with fictional elements. The novel is centered around the bombing of Dresden during World War II, which is an actual historical event. However, Vonnegut introduces invented details and fictional elements, such as the protagonist Billy Pilgrim's experiences with time travel and alien abduction by the Tralfamadorians. These elements are clearly fictional and could not have occurred, especially considering the standards and context of the time. Therefore, while the backdrop of the Dresden bombing is real, the specific aspect of time travel and alien abduction is entirely fictional and impossible. Score=4","""Slaughterhouse-Five"" by Kurt Vonnegut is a novel that blends elements of science fiction with historical events. The settings in the book include real geographical locations such as Dresden, Germany, during World War II, which is depicted with both historical accuracy and some fictionalized details. Additionally, the novel features the invented planet of Tralfamadore, which is a location that could not have existed based on our understanding of the universe.

Considering the specified referent of settings, the novel includes both real locations with invented details and entirely fictional locations. The presence of Tralfamadore, an invented location that could not have existed, is a significant aspect of the novel's setting. Therefore, based on the scale provided, the setting of ""Slaughterhouse-Five"" aligns with the category of ""Invented locations that could not have existed.""

Score=4",3,4,4
"Ficciones","Jorge Luis Borges",1944,"Argentina","Ficciones by Jorge Luis Borges written in 1944","""Ficciones"" by Jorge Luis Borges is a collection of short stories that often features characters who are either entirely fictional or are fictionalized versions of real people. Borges is known for blending reality with fiction, creating characters that exist in a realm where the boundaries between the two are blurred. Many of the characters in ""Ficciones"" are invented and exist in fantastical or highly improbable scenarios, such as in stories like ""Tlön, Uqbar, Orbis Tertius"" and ""The Library of Babel."" These characters often serve as vehicles for exploring philosophical and metaphysical themes rather than as realistic portrayals of individuals who could have existed in the real world. Given the context of the time and Borges's literary style, the characters in ""Ficciones"" are best categorized as invented characters whose existence is improbable or could not have existed. Therefore, the appropriate score for the main characters in ""Ficciones"" is 4. Score=4","""Ficciones"" by Jorge Luis Borges is a collection of short stories that often blend reality with fiction, exploring complex philosophical and metaphysical themes. The stories frequently involve invented historical events, characters, and settings that challenge the boundaries of reality and fiction. Borges is known for his use of fantastical elements and intricate narratives that create worlds that are both imaginative and intellectually stimulating.

Given the context of the time and Borges's style, the events in ""Ficciones"" are typically invented historical events whose occurrence is improbable. Borges's work often involves fantastical libraries, infinite books, and labyrinthine worlds that defy the conventional understanding of reality. These elements are crafted with such intellectual rigor that they could be imagined as possible within the fictional universe he creates, but they remain improbable in the real world.

Therefore, the events in ""Ficciones"" align with the category of invented historical events whose occurrence is improbable. Score=3","""Ficciones"" by Jorge Luis Borges is a collection of short stories that often explore complex philosophical and metaphysical themes through the use of intricate and imaginative settings. Borges is known for creating fictional worlds that challenge the boundaries of reality and fiction. Many of the stories in ""Ficciones"" feature invented locations that are highly improbable or impossible, such as the infinite library in ""The Library of Babel"" or the fictional country of Tlön in ""Tlön, Uqbar, Orbis Tertius."" These settings are crafted to explore abstract ideas and are not intended to represent real or plausible geographical locations. Given the fantastical and speculative nature of these settings, they fall into the category of invented locations that could not have existed. Score=4",4,3,4
"The Sound and the Fury","William Faulkner",1929,"United States","The Sound and the Fury by William Faulkner written in 1929","""The Sound and the Fury"" by William Faulkner is a novel that features the Compson family, a fictional Southern family in the early 20th century. The main characters, such as Benjy, Quentin, Caddy, and Jason Compson, are invented by Faulkner. These characters are deeply rooted in the social and cultural context of the American South during that era, and their struggles and experiences reflect the historical and societal issues of the time, such as the decline of Southern aristocracy and the complexities of family dynamics. While the characters are fictional, they are crafted with a level of realism that makes their existence plausible within the context of the time period. Therefore, they are invented characters who could have existed. Score=2","""The Sound and the Fury"" by William Faulkner is a novel that explores the decline of the Compson family in the American South. The events depicted in the novel are fictional, but they are set against a backdrop that reflects the social and cultural realities of the early 20th century Southern United States. The Compson family's struggles with issues such as honor, pride, and the changing social order are representative of broader historical themes, but the specific events and characters are invented by Faulkner. Given that the novel's events are fictional yet plausible within the historical context of the time, they fall into the category of invented historical events that could have occurred. Therefore, the appropriate score is:

Score=2","""The Sound and the Fury"" by William Faulkner is set in the fictional Yoknapatawpha County, Mississippi. Faulkner created this setting as a microcosm of the American South, drawing heavily on real geographical locations and cultural elements of Mississippi. While Yoknapatawpha County itself is invented, it is designed to closely resemble real Southern locales, with detailed descriptions that make it plausible as a real place. Given the context of the time, Faulkner's creation of a fictional county that mirrors real geographical locations with invented details fits well within the literary tradition of Southern Gothic fiction. Therefore, the setting of ""The Sound and the Fury"" aligns with the category of real geographical locations with invented details. Score=1",2,2,1
"In Cold Blood","Truman Capote",1966,"United States","In Cold Blood by Truman Capote written in 1966","""In Cold Blood"" by Truman Capote is a non-fiction novel that details the real-life murders of the Clutter family in Holcomb, Kansas, in 1959. The main characters in the book, including the Clutter family and the murderers Perry Smith and Richard ""Dick"" Hickock, are based on real people. Capote conducted extensive research and interviews to portray these individuals and events accurately. However, he did incorporate some invented biographical details and dialogue to enhance the narrative and provide deeper insight into the characters' thoughts and motivations. Given the standards and context of the time, this approach was innovative and somewhat controversial, as it blurred the lines between journalism and fiction. Therefore, the main characters in ""In Cold Blood"" are real characters with some invented biographical details. Score=1","""In Cold Blood"" by Truman Capote is a non-fiction novel that details the real-life murder of the Clutter family in Holcomb, Kansas, in 1959. Capote conducted extensive research and interviews to reconstruct the events surrounding the crime and the subsequent investigation. While the book is based on actual historical events, Capote is known to have added some invented details for narrative effect and to enhance the storytelling. This approach aligns with the standards of the time, as the book is often credited with pioneering the true crime genre by blending factual reporting with literary techniques. Therefore, the events in ""In Cold Blood"" can be classified as actual historical events with invented details. Score=1","""In Cold Blood"" by Truman Capote is a non-fiction novel that details the real-life events surrounding the 1959 murders of the Clutter family in Holcomb, Kansas. The settings in the book are based on actual geographical locations, including the town of Holcomb and other parts of Kansas. Capote's work is known for its meticulous attention to detail and factual accuracy, as he conducted extensive research and interviews to portray the events and settings authentically. Therefore, the settings in ""In Cold Blood"" are real geographical locations without invented details. Score=0",1,1,0
"The Stranger","Albert Camus",1942,"France","The Stranger by Albert Camus written in 1942","""The Stranger"" by Albert Camus, published in 1942, features the main character Meursault, who is a French Algerian. Meursault is depicted as an emotionally detached and indifferent individual, which aligns with existentialist themes. The character is a realistic portrayal of a person who could exist, especially within the context of French colonial Algeria during the early 20th century. His actions and thoughts, while sometimes extreme, are grounded in a philosophical exploration of absurdism rather than fantastical or improbable traits. Therefore, Meursault and the other characters in the novel are invented but could have existed in the real world. Score=2","In ""The Stranger"" by Albert Camus, the specific referent of interest is the murder of an Arab man by the protagonist, Meursault, on a beach in French-colonial Algeria. This event is a fictional creation by Camus, but it is set against the backdrop of a real historical context—French colonial rule in Algeria. The murder itself is a plausible event that could have occurred during that time period, as it reflects the tensions and conflicts present in colonial societies. Therefore, the event is an invented historical event that could have occurred, given the socio-political context of the era. Score=2","""The Stranger"" by Albert Camus is set in Algiers, the capital city of Algeria, during the time when Algeria was a French colony. The geographical locations in the novel are real and accurately reflect the setting of Algiers in the early 20th century. Camus, who was born in Algeria, uses real locations such as the beach, the courthouse, and the streets of Algiers to ground the story in a tangible and authentic environment. There are no invented details that alter the geographical reality of the setting. Therefore, based on the specified referent of settings, the work should be evaluated as using real geographical locations. Score=0",2,2,0
"Sherlock Holmes","Conan Doyle",1887,"United Kingdom","Sherlock Holmes by Conan Doyle written in 1887","Sherlock Holmes, created by Arthur Conan Doyle in 1887, features main characters who are invented but could have existed within the context of the time. Sherlock Holmes, a brilliant detective, and Dr. John Watson, his companion, are fictional but are grounded in the reality of late 19th-century London. Their characteristics, professions, and the world they inhabit are plausible and reflect the societal norms and advancements of the era. Holmes's methods, while sometimes extraordinary, are based on logical reasoning and scientific principles that were emerging at the time. Therefore, the characters are invented but could have existed. Score=2","The Sherlock Holmes stories by Arthur Conan Doyle, beginning with ""A Study in Scarlet"" in 1887, are fictional detective tales set in the late 19th and early 20th centuries. The events depicted in these stories involve the character Sherlock Holmes solving various mysteries and crimes. While the setting and some background details reflect the real historical context of Victorian and Edwardian London, the specific events and cases Holmes investigates are entirely fictional. However, they are crafted in such a way that they could plausibly occur within the context of the time period, given the societal and technological conditions of the era. Therefore, the events can be classified as invented historical events that could have occurred. Score=2","The settings in the Sherlock Holmes stories by Arthur Conan Doyle, beginning with ""A Study in Scarlet"" in 1887, are primarily based on real geographical locations. The stories are set in London and other parts of England, which are depicted with a high degree of accuracy and detail. Doyle's descriptions of places like Baker Street, where Holmes resides, and other parts of London, are based on real locations, although some specific details, such as the exact address of 221B Baker Street, are fictional. However, these invented details are minor and do not detract from the overall realism of the setting. Considering the standards and context of the time, the settings are best described as real geographical locations with some invented details. Score=1",2,2,1
"The French Lieutenant's Woman","John Fowles",1969,"United Kingdom","The French Lieutenant's Woman by John Fowles written in 1969","""The French Lieutenant's Woman"" by John Fowles is a novel set in the Victorian era, and it features a mix of historical and fictional elements. The main characters, such as Charles Smithson and Sarah Woodruff, are invented by Fowles. They are crafted with a high degree of realism, reflecting the social and cultural contexts of the 19th century. These characters could plausibly have existed within the historical setting of the novel, as they are depicted with detailed psychological depth and social backgrounds that align with the period's norms and issues. Therefore, they fall into the category of invented characters who could have existed. Score=2","""The French Lieutenant's Woman"" by John Fowles is a novel set in the Victorian era, specifically in the 1860s. The book is known for its metafictional elements and its exploration of the social and cultural norms of the time. When evaluating the historical events depicted in the novel, it's important to note that while the setting and social context are grounded in actual historical details of the Victorian period, the specific events and characters are fictional.

The novel does not focus on major historical events but rather on the personal and social dynamics of its characters, which are plausible within the context of the time. The invented historical events, such as the personal lives and interactions of the characters, could have occurred given the societal norms and conditions of the Victorian era. Therefore, these events are invented but plausible within the historical context.

Score=2","""The French Lieutenant's Woman"" by John Fowles is set in the Victorian era, primarily in the town of Lyme Regis on the Dorset coast of England. Lyme Regis is a real geographical location, and Fowles incorporates authentic details about the town and its surroundings. However, he also adds fictional elements and embellishments to the setting to serve the narrative and thematic purposes of the novel. This blend of real and invented details aligns with the second category on the scale, as it involves real geographical locations with invented details. Therefore, the appropriate score for the setting of this work is: Score=1",2,2,1
"Midnight's Children","Salman Rushdie",1981,"India/United Kingdom","Midnight's Children by Salman Rushdie written in 1981","""Midnight's Children"" by Salman Rushdie is a novel that features a blend of historical and fantastical elements. The main characters, such as Saleem Sinai, are invented characters who are deeply intertwined with real historical events in India, particularly around the time of its independence and partition. While these characters are fictional, they are crafted in a way that they could plausibly exist within the context of the historical backdrop provided by the novel. The magical realism aspect of the story introduces fantastical elements, but the characters themselves are portrayed as if they could have been real individuals living through those times. Therefore, based on the specified referent of main characters, they are best categorized as invented characters who could have existed. Score=2","""Midnight's Children"" by Salman Rushdie is a novel that intertwines the personal life of its protagonist, Saleem Sinai, with the historical events of India, particularly around the time of its independence and partition. The novel is known for its magical realism, where historical events are interwoven with fantastical elements. 

The specific aspect to evaluate here is the historical events depicted in the novel. Rushdie uses actual historical events, such as the partition of India in 1947 and the subsequent political developments, as a backdrop for the story. However, he embellishes these events with fictional and fantastical details, such as the protagonist's telepathic abilities and the existence of other children with special powers born at the stroke of midnight when India gained independence.

Given the context of the time and the nature of the novel, the historical events in ""Midnight's Children"" are actual events with invented details that serve the narrative's magical realism. Therefore, the appropriate score for this aspect is:

Score=1","""Midnight's Children"" by Salman Rushdie is set primarily in real geographical locations, such as Bombay (now Mumbai), Delhi, and other parts of India and Pakistan. These settings are depicted with a mix of historical accuracy and magical realism. While the cities and regions themselves are real, Rushdie infuses them with fantastical elements and invented details that enhance the narrative's magical realism. This blend of reality with imaginative embellishments aligns with the second category on the scale, as the locations are real but include invented details that serve the story's thematic and narrative purposes. Score=1",2,1,1
"The Odyssey","Homer",-800,"Greece","The Odyssey by Homer written in -800","The Odyssey by Homer is an ancient Greek epic poem that features a mix of real and mythological elements. The main character, Odysseus, is a legendary Greek hero whose existence is not historically verified, but he is portrayed as a human with plausible traits and experiences that could have been inspired by real individuals or events from the time. However, the narrative includes fantastical elements and encounters with mythical creatures, which makes the existence of Odysseus as depicted in the poem improbable. Given the standards and context of the time, where myth and history often intertwined, Odysseus can be seen as an invented character whose existence is improbable. Score=3","The Odyssey by Homer is an epic poem that recounts the journey of the Greek hero Odysseus as he returns home from the Trojan War. The specific aspect to evaluate here is the events described in the narrative. The Odyssey includes a mix of mythological and fantastical elements, such as encounters with gods, mythical creatures like the Cyclops, and magical occurrences. These events are not based on actual historical events and are rooted in Greek mythology and storytelling traditions. Given the context of the time, these stories were not intended to be historical accounts but rather mythological tales that conveyed cultural values and entertained audiences. Therefore, the events described in The Odyssey are invented historical events that could not have occurred. Score=4","The Odyssey by Homer is an ancient Greek epic poem that features a mix of real geographical locations and mythical elements. The story includes real places such as Ithaca, Troy, and various parts of the Mediterranean, which were known to the ancient Greeks. However, it also incorporates fantastical locations like the island of the Cyclopes, the land of the Lotus-Eaters, and the realm of the dead, which are clearly invented and imbued with mythical qualities. These invented locations are integral to the narrative and reflect the mythological worldview of the time, making their existence improbable in a literal sense but plausible within the context of ancient Greek mythology. Therefore, considering the standards and context of the time, the settings in The Odyssey can be evaluated as invented locations whose existence is improbable. Score=3",3,4,3
