"Title","Author.Creator","Year","Region","to_annotate","annotation_characters","annotation_events","annotation_settings","score_characters","score_events","score_settings"
"Le Morte d’Arthur","Sir Thomas Malory",1485,"England","Le Morte d’Arthur by Sir Thomas Malory written in 1485","""Le Morte d’Arthur"" by Sir Thomas Malory is a compilation and reinterpretation of the legendary tales of King Arthur, his knights, and the mythical realm of Camelot. The main characters, such as King Arthur, Sir Lancelot, and Merlin, are based on a mix of historical figures, folklore, and myth. While there may have been historical figures who inspired these characters, the specific portrayals in Malory's work are heavily fictionalized and imbued with fantastical elements, such as magic and mythical creatures, which make their existence as depicted improbable. Given the standards and context of the 15th century, these characters are best categorized as invented characters whose existence is improbable. Score=3","""Le Morte d’Arthur"" by Sir Thomas Malory is a compilation of Arthurian legends, which are a blend of folklore, literary invention, and some historical elements. The work is set in a legendary version of Britain and involves characters like King Arthur, Merlin, and the Knights of the Round Table. While there may be some historical basis for a leader like Arthur in post-Roman Britain, the specific events and characters in Malory's work are largely fictionalized and mythologized.

Considering the standards and context of the time, Malory's work was not intended as a historical account but rather as a chivalric romance. The events described, such as the quest for the Holy Grail and the magical elements involving Merlin, are not grounded in historical reality. They are part of a legendary tradition that was well-known in medieval literature.

Therefore, the events in ""Le Morte d’Arthur"" are best categorized as invented historical events whose occurrence is improbable, given the magical and legendary nature of the narrative.

Score=3","""Le Morte d’Arthur"" by Sir Thomas Malory is a compilation of Arthurian legends, which are set in a mix of real and fictional locations. The work includes references to real geographical locations such as England, France, and Rome, but it also features invented places like Camelot and Avalon. These fictional locations are central to the Arthurian legends and are depicted as if they could have existed within the medieval context. However, their existence is improbable given the mythical and fantastical elements associated with them, such as magical occurrences and legendary figures. Considering the standards and context of the 15th century, where myth and history often intertwined, the invented locations in ""Le Morte d’Arthur"" are presented in a way that suggests they could have existed in a legendary past, but their actual existence is unlikely. Therefore, the work fits the category of ""Invented locations whose existence is improbable."" Score=3",3,3,3
"Don Quixote","Miguel de Cervantes",1605,"Spain","Don Quixote by Miguel de Cervantes written in 1605","""Don Quixote"" by Miguel de Cervantes is a seminal work in Western literature, often considered the first modern novel. The main characters, Don Quixote and Sancho Panza, are invented characters who could have existed within the context of the early 17th century. Don Quixote is portrayed as a nobleman who becomes a self-styled knight-errant, driven by his obsession with chivalric romances. While his actions and delusions are exaggerated for comedic and satirical effect, the character is grounded in the social and cultural milieu of the time, reflecting the tensions between medieval ideals and the emerging modern world. Sancho Panza, his squire, is a more realistic character, representing the common man. Both characters, while fictional, are plausible within the historical and cultural context of Cervantes' Spain. Therefore, they fit the category of invented characters who could have existed. Score=2","""Don Quixote"" by Miguel de Cervantes is a seminal work of literature that blends reality with fiction in a satirical manner. The specific aspect to evaluate here is the events within the narrative. The story follows the adventures of a man who, inspired by chivalric romances, decides to become a knight-errant. The events in ""Don Quixote"" are largely invented and satirical, designed to parody the chivalric tales popular at the time. While the setting and some social elements reflect the real world of 16th and 17th century Spain, the specific adventures and occurrences, such as tilting at windmills and mistaking inns for castles, are improbable and fantastical. These events are not grounded in historical reality and are meant to be humorous exaggerations. Therefore, the events in ""Don Quixote"" are best categorized as invented historical events whose occurrence is improbable. Score=3","""Don Quixote"" by Miguel de Cervantes is set in real geographical locations within Spain, specifically in the regions of La Mancha, Aragón, and Catalonia, among others. These are actual places that existed during Cervantes' time and continue to exist today. While the narrative includes fictional elements and adventures, the settings themselves are based on real locations with some invented details to serve the story. Cervantes uses these real settings to ground the fantastical elements of Don Quixote's adventures, making the contrast between reality and imagination a central theme of the novel. Given the context of the time, the use of real geographical locations with some fictional embellishments aligns with the literary style of the period. Therefore, the appropriate score for the settings in ""Don Quixote"" is:

Score=1",2,3,1
"The Adventures of Tom Sawyer","Mark Twain",1876,"United States","The Adventures of Tom Sawyer by Mark Twain written in 1876","""The Adventures of Tom Sawyer"" by Mark Twain features main characters who are primarily invented but could have existed within the context of the 19th-century American setting. Tom Sawyer, Huck Finn, and other characters are fictional, yet they are crafted with realistic traits and behaviors that reflect the lives of children and adults in a small town along the Mississippi River during that era. Their adventures, while sometimes exaggerated for literary effect, are grounded in the social and cultural realities of the time. Therefore, the characters are invented but plausible within their historical context. Score=2","""The Adventures of Tom Sawyer"" by Mark Twain is a novel set in the mid-19th century in the fictional town of St. Petersburg, Missouri, which is based on Twain's own childhood hometown of Hannibal, Missouri. The events in the novel are largely fictional, but they are inspired by Twain's own experiences and the social context of the time. The story includes events such as Tom and Huck witnessing a murder, Tom getting lost in a cave, and the boys attending their own funeral. These events are invented but are plausible within the context of the time period and setting. They reflect the adventurous and mischievous nature of childhood during that era, making them events that could have occurred, albeit with some embellishment for narrative effect. Therefore, the events in ""The Adventures of Tom Sawyer"" can be classified as invented historical events that could have occurred. Score=2","""The Adventures of Tom Sawyer"" by Mark Twain is set in the fictional town of St. Petersburg, Missouri, which is based on the real town of Hannibal, Missouri, where Twain grew up. The setting includes real geographical locations such as the Mississippi River, but with some invented details to enhance the narrative. Given the context of the time, Twain's depiction of St. Petersburg is a blend of real and fictional elements, making it a real geographical location with invented details. Therefore, the appropriate score for the setting is:

Score=1",2,2,1
"Les Misérables","Victor Hugo",1862,"France","Les Misérables by Victor Hugo written in 1862","In ""Les Misérables"" by Victor Hugo, the main characters are primarily invented, but they are crafted with a high degree of realism and historical context. Characters like Jean Valjean, Javert, and Fantine are fictional, yet they are deeply rooted in the social and political realities of 19th-century France. Hugo's characters are plausible within the historical and social framework of the time, reflecting the struggles and conditions of the era. Therefore, they are invented characters who could have existed, as they embody the experiences and challenges faced by real people during that period. Score=2","In ""Les Misérables"" by Victor Hugo, the events are set against the backdrop of early 19th-century France, particularly focusing on the period following the Napoleonic Wars and leading up to the June Rebellion of 1832. The novel incorporates actual historical events, such as the Battle of Waterloo and the June Rebellion, but it also includes fictional characters and invented details to enhance the narrative. While the main events are rooted in historical reality, Hugo takes creative liberties with the details and personal stories of his characters, which are fictional. Therefore, the work can be classified as actual historical events with invented details. Score=1","""Les Misérables"" by Victor Hugo is set in real geographical locations, primarily in France, including Paris and various other towns and regions. The novel meticulously describes these settings with a high degree of accuracy, reflecting the socio-political landscape of 19th-century France. Hugo's attention to detail in depicting the streets, neighborhoods, and landmarks of Paris, as well as the broader French countryside, aligns with the real geographical locations of the time. Therefore, the settings in ""Les Misérables"" are based on real geographical locations without the addition of invented details that would alter their authenticity. Score=0",2,1,0
"One Hundred Years of Solitude","Gabriel García Márquez",1967,"Colombia","One Hundred Years of Solitude by Gabriel García Márquez written in 1967","""One Hundred Years of Solitude"" by Gabriel García Márquez is a seminal work of magical realism, a genre that blends fantastical elements with realistic settings and characters. The main characters in the novel, such as the Buendía family, are invented characters who are deeply rooted in the socio-political and cultural context of Latin America. They are portrayed with rich, complex personalities and life stories that reflect the human condition and historical realities of the region. However, the novel also incorporates elements of the fantastical and the improbable, such as characters who live for over a century, ghosts, and other supernatural occurrences. These elements make the existence of the characters improbable in a literal sense, but they are crafted in a way that they could metaphorically exist within the narrative's magical realist framework. Therefore, the main characters are best categorized as invented characters whose existence is improbable. Score=3","""One Hundred Years of Solitude"" by Gabriel García Márquez is a seminal work of magical realism, a genre that blends fantastical elements with realistic settings. The novel chronicles the multi-generational story of the Buendía family in the fictional town of Macondo. The events in the book are deeply infused with magical realism, where extraordinary and supernatural occurrences are presented as part of everyday life.

When evaluating the events in ""One Hundred Years of Solitude"" based on the specified referent, we must consider the context of magical realism and the standards of the time. The novel includes events such as characters living for over a century, ghosts interacting with the living, and rain lasting for years, which are clearly fantastical and not grounded in historical reality. These elements are integral to the narrative style and thematic depth of the work, but they are not events that could have occurred in reality.

Given this context, the events in ""One Hundred Years of Solitude"" are best categorized as invented historical events that could not have occurred, due to their fantastical nature and the deliberate blending of the magical with the mundane.

Score=4","""One Hundred Years of Solitude"" by Gabriel García Márquez is set in the fictional town of Macondo. The town is depicted with a rich blend of magical realism, where extraordinary events occur alongside the mundane. Macondo is presented as a place that could have existed, with its detailed social structure, history, and cultural elements that mirror those of Latin American towns. However, the magical and fantastical elements, such as the rain of yellow flowers and the presence of ghosts, make its existence improbable in a real-world context. Therefore, considering the standards and context of the time, Macondo is an invented location whose existence is improbable. Score=3",3,4,3
"Voyage dans la lune","Cyrano de Bergerac",NA,"","Voyage dans la lune by Cyrano de Bergerac written in NA","""Voyage dans la lune"" by Cyrano de Bergerac, written in the 17th century, is a work of early science fiction. The main characters in this narrative are largely invented and include fantastical elements, such as inhabitants of the moon and other celestial beings. Given the context of the time, these characters are imaginative and reflect the speculative nature of the work. The existence of such characters is improbable, as they are based on the fictional and fantastical exploration of the moon, which was beyond the scientific understanding of the era. Therefore, the main characters fall into the category of invented characters whose existence is improbable. Score=3","""Voyage dans la lune"" by Cyrano de Bergerac is a work of early science fiction written in the 17th century. The story involves a journey to the moon, which, at the time, was a fantastical concept. During the 17th century, the idea of space travel was purely speculative and not grounded in any scientific reality. The events described in the book, such as traveling to the moon using fantastical means, are entirely invented and could not have occurred given the scientific understanding and technological capabilities of the time. Therefore, the events in ""Voyage dans la lune"" fall into the category of invented historical events that could not have occurred. Score=4","""Voyage dans la lune"" by Cyrano de Bergerac is a work of early science fiction that describes a fantastical journey to the moon. In the context of the 17th century, when the work was written, the moon was a mysterious and largely unknown celestial body. The settings in the story include the moon itself, which is depicted with imaginative and fantastical details, such as inhabitants and landscapes that are entirely fictional. Given the scientific understanding of the time, the moon was a place that could be speculated about but was not known to have the characteristics described in the story. Therefore, the moon as depicted in ""Voyage dans la lune"" is an invented location whose existence, as described, is improbable based on the knowledge of the era. Score=3",3,4,3
"The Lusiads","Luís de Camões",1572,"Portugal","The Lusiads by Luís de Camões written in 1572","""The Lusiads"" by Luís de Camões is an epic poem that primarily focuses on the real historical figure of Vasco da Gama and his voyage to India. The main characters in the poem are largely based on real historical figures, such as Vasco da Gama and his crew, who were actual Portuguese explorers. However, the poem also includes mythological elements and divine interventions, which were common in epic poetry of the time, drawing from classical traditions. Despite these mythological aspects, the main characters themselves are rooted in historical reality, with some artistic embellishments typical of epic storytelling. Therefore, considering the standards and context of the 16th century, the main characters can be classified as real characters with some invented biographical details. Score=1","""The Lusiads"" by Luís de Camões is an epic poem that primarily recounts the Portuguese voyages of discovery during the Age of Exploration, focusing on Vasco da Gama's pioneering sea route to India. The poem blends historical events with mythological and fantastical elements. 

When evaluating the historical events depicted in ""The Lusiads,"" particularly Vasco da Gama's journey, it is important to consider the standards and context of the 16th century. The poem is based on actual historical events, specifically the real voyage of Vasco da Gama from 1497 to 1499. However, Camões embellishes these events with invented details, such as divine interventions by gods and mythical creatures, which were common literary devices of the time to enhance the narrative.

Given this context, the events in ""The Lusiads"" can be classified as actual historical events with invented details. The core journey and its significance are historically accurate, but the narrative is enriched with fictional elements typical of epic poetry.

Score=1","""The Lusiads"" by Luís de Camões is an epic poem that primarily recounts the voyages of Portuguese explorer Vasco da Gama and the discovery of the sea route to India. The settings in the poem are largely based on real geographical locations, such as Lisbon, the Cape of Good Hope, and Calicut. However, Camões embellishes these real locations with mythological and fantastical elements, such as encounters with gods and mythical creatures, which were common literary devices of the time to enhance the narrative.

Given the context of the 16th century, when exploration was at its peak and the blending of real and mythical elements was a popular literary technique, the settings in ""The Lusiads"" can be seen as real geographical locations with invented details. This aligns with the second point on the scale, as the poem uses actual places but adds fictionalized elements to enrich the story.

Score=1",1,1,1
"Gargantua","Rabelais",1534,"France","Gargantua by Rabelais written in 1534","""Gargantua"" by François Rabelais is a satirical and comedic work that features the character Gargantua, a giant with an insatiable appetite and extraordinary abilities. The story is filled with exaggerated and fantastical elements, reflecting the Renaissance humanist context in which it was written. The character of Gargantua is an invented one, drawing on folklore and mythological traditions of giants, but his existence is highly improbable given his exaggerated size and capabilities. The narrative uses these fantastical elements to explore themes of education, religion, and society, often in a humorous and critical manner. Considering the standards and context of the 16th century, Gargantua is a character that could not have existed in reality. Score=4","""Gargantua"" by François Rabelais is a satirical and comedic work that features the life and adventures of the giant Gargantua. The narrative includes exaggerated and fantastical events, such as Gargantua's miraculous birth, his prodigious appetite, and his extraordinary feats. These events are clearly intended as satire and humor, rather than as a depiction of actual historical occurrences. Given the context of the 16th century, when the work was written, such fantastical elements were understood as part of the genre of satire and parody, rather than as plausible historical events. Therefore, the events in ""Gargantua"" are invented historical events that could not have occurred, as they involve supernatural and impossible elements. Score=4","""Gargantua"" by François Rabelais is a satirical and comedic work that features a mix of real and fantastical elements. The settings in ""Gargantua"" include both real geographical locations and invented ones. Rabelais uses real places, such as Paris and the Abbey of Saint-Victor, but he also introduces fictional locations like the Abbey of Thélème, which is a utopian monastery that operates on principles contrary to those of real monastic life at the time. The Abbey of Thélème, with its fantastical and idealized nature, represents an invented location whose existence is improbable, as it defies the social and religious norms of the 16th century. Therefore, considering the standards and context of the time, the settings in ""Gargantua"" can be evaluated as invented locations whose existence is improbable. Score=3",4,4,3
"The Canterbury Tales","Geoffrey Chaucer",1400,"England","The Canterbury Tales by Geoffrey Chaucer written in 1400","""The Canterbury Tales"" by Geoffrey Chaucer is a collection of stories told by a group of pilgrims traveling to Canterbury. The main characters in the tales are the pilgrims themselves, who are depicted as a diverse group of individuals from various walks of life, such as the Knight, the Miller, the Wife of Bath, and the Pardoner. These characters are fictional but are crafted to represent real social types and classes from 14th-century England. Chaucer's characters are believable and reflect the societal norms and occupations of the time, making them invented characters who could have existed. Therefore, based on the specified referent, the main characters in ""The Canterbury Tales"" would be evaluated as: Score=2","The Canterbury Tales by Geoffrey Chaucer is a collection of stories told by a group of pilgrims traveling to Canterbury. The specific aspect to evaluate here is the pilgrimage itself. During the 14th century, pilgrimages to religious sites like Canterbury were common in England, and Chaucer's depiction of a group of pilgrims traveling together reflects an actual historical practice. While the individual characters and their stories are fictional, the event of a pilgrimage to Canterbury is based on actual historical events. Therefore, the pilgrimage itself can be classified as actual historical events with invented details, as Chaucer adds fictional characters and narratives to the real practice of pilgrimage. Score=1","""The Canterbury Tales"" by Geoffrey Chaucer is set in real geographical locations, specifically in England. The narrative follows a group of pilgrims traveling from London to the shrine of Saint Thomas Becket in Canterbury. The journey takes place along a well-known route, and the settings described, such as the Tabard Inn in Southwark, are based on actual places that existed during Chaucer's time. While some details may be embellished for literary purposes, the settings are grounded in real locations that were familiar to Chaucer's contemporary audience. Therefore, the work fits the category of real geographical locations. Score=0",2,1,0
"Faust","Johann Wolfgang von Goethe",1808,"Germany","Faust by Johann Wolfgang von Goethe written in 1808","In Johann Wolfgang von Goethe's ""Faust,"" the main characters include Faust, Mephistopheles, and Gretchen (Margarete). Faust is a scholar who makes a pact with the devil, Mephistopheles, in exchange for unlimited knowledge and worldly pleasures. While Faust is based on the historical figure Johann Georg Faust, a German alchemist and magician, Goethe's portrayal includes significant fictional elements, such as the supernatural pact with Mephistopheles. Mephistopheles, as a devilish figure, is a character rooted in folklore and religious tradition, representing an embodiment of evil and temptation. Gretchen is a character who could plausibly exist as a young woman in Goethe's time, but her involvement in the fantastical elements of the story ties her to the fictional narrative.

Considering the standards and context of the early 19th century, the characters in ""Faust"" are primarily invented with elements that make their existence improbable, especially due to the supernatural and allegorical aspects of the story. Therefore, the main characters in ""Faust"" fall into the category of invented characters whose existence is improbable.

Score=3","In Goethe's ""Faust,"" the specific referent of interest is the pact between Faust and Mephistopheles, where Faust sells his soul to the devil in exchange for unlimited knowledge and worldly pleasures. This event is a central element of the narrative and is rooted in the legend of Faust, a character from German folklore. The idea of making a pact with the devil is a common motif in literature and folklore, symbolizing the human struggle with temptation and the quest for knowledge and power. However, such a pact is a supernatural event that could not have occurred in reality, as it involves elements beyond the natural world and human experience. Considering the standards and context of the time, this event is a fictional construct used to explore philosophical and moral themes. Therefore, the event is best categorized as invented historical events that could not have occurred. Score=4","In ""Faust"" by Johann Wolfgang von Goethe, the settings primarily include real geographical locations with some invented details. The story is set in Germany, with specific references to places like Leipzig and the Harz Mountains, which are real. However, Goethe adds fictional elements and details to these settings to serve the narrative and thematic purposes of the play. For example, the scenes involving supernatural elements, such as the Walpurgis Night on the Brocken, blend real locations with fantastical details. Considering the standards and context of the time, this blend of real and invented details was a common literary technique to enhance the story's dramatic and thematic impact. Therefore, the work fits the category of real geographical locations with invented details. Score=1",3,4,1
