"Title","Author.Creator","Year","Region","to_annotate","annotation_characters","annotation_events","annotation_settings","score_characters","score_events","score_settings"
"The Rubaiyat of Omar Khayyam","Omar Khayyam",1120,"Persia","The Rubaiyat of Omar Khayyam by Omar Khayyam written in 1120","""The Rubaiyat of Omar Khayyam"" is a collection of quatrains attributed to Omar Khayyam, a Persian mathematician, astronomer, and poet who lived during the 11th and 12th centuries. The main character in this work is often considered to be a poetic persona or voice that reflects on themes such as the nature of life, the passage of time, and the pursuit of happiness. This persona is not a distinct character with a detailed biography but rather a philosophical voice that could represent Khayyam himself or a generalized human experience.

Given the context of the time, the persona in the quatrains could be seen as an invented character who embodies philosophical ideas and reflections that were common in Persian literature. This character could have existed as a representation of a thoughtful individual pondering life's mysteries, which aligns with the cultural and intellectual milieu of the period.

Therefore, the main character in ""The Rubaiyat of Omar Khayyam"" can be evaluated as an invented character who could have existed, reflecting the philosophical and contemplative nature of the work. 

Score=2","The Rubaiyat of Omar Khayyam is a collection of quatrains (four-line poems) attributed to the Persian mathematician, astronomer, and poet Omar Khayyam. The work is primarily philosophical and reflective, focusing on themes such as the nature of life, the passage of time, and the pursuit of happiness. It does not aim to recount historical events but rather to explore existential and metaphysical ideas through poetry.

Given the nature of the work, it does not present historical events in the traditional sense. Instead, it offers philosophical musings and allegorical reflections. Therefore, the aspect of ""events"" as defined in the scale does not directly apply to The Rubaiyat. However, if we consider the philosophical reflections as ""invented historical events"" in a metaphorical sense, they are not meant to be taken as literal occurrences. They are more akin to invented scenarios or allegories that illustrate philosophical points.

Considering the standards and context of the time, The Rubaiyat's reflections are timeless and not bound to specific historical events. Thus, they could be seen as ""invented historical events whose occurrence is improbable"" in a literal sense, but this is a metaphorical interpretation.

Score=3","""The Rubaiyat of Omar Khayyam"" is a collection of quatrains attributed to the Persian mathematician, astronomer, and poet Omar Khayyam. The work is primarily philosophical and reflective, focusing on themes such as the nature of life, the passage of time, and the pursuit of happiness. It does not emphasize specific geographical settings or locations. However, when it does reference locations, they are typically real places within the Persian Empire, such as Nishapur, where Khayyam lived. These references are consistent with the real geographical context of the time.

Given that the work uses real geographical locations with no significant invented details, the appropriate score for the settings in ""The Rubaiyat of Omar Khayyam"" is 0. 

Score=0",2,3,0
"War and Peace","Leo Tolstoy",1869,"Russia","War and Peace by Leo Tolstoy written in 1869","""War and Peace"" by Leo Tolstoy is a historical novel set during the Napoleonic Wars, specifically focusing on the French invasion of Russia. The main characters in the novel include Pierre Bezukhov, Prince Andrei Bolkonsky, and Natasha Rostova, among others. These characters are fictional creations of Tolstoy, but they are crafted with such depth and realism that they could plausibly have existed in the historical context of early 19th-century Russia. Tolstoy's attention to historical detail and the social dynamics of the time lends credibility to his characters, making them feel authentic and believable within the setting. Therefore, the main characters in ""War and Peace"" are best categorized as invented characters who could have existed. Score=2","""War and Peace"" by Leo Tolstoy is a historical novel set during the Napoleonic Wars, specifically focusing on the French invasion of Russia. The novel intricately weaves real historical events with fictional narratives and characters. Tolstoy meticulously researched the period and incorporated actual historical events, such as the Battle of Borodino and the French retreat from Moscow, into the storyline. However, he also added invented details and fictional characters to enhance the narrative and explore philosophical themes.

Given the context of the time and the nature of the work, the events in ""War and Peace"" can be classified as actual historical events with invented details. Tolstoy's blending of fact and fiction serves to provide a rich, immersive experience while maintaining a foundation in real history.

Score=1","""War and Peace"" by Leo Tolstoy is set in real geographical locations, primarily in Russia and parts of Europe, during the Napoleonic Wars. The novel meticulously describes actual cities, such as Moscow and St. Petersburg, and real historical events, such as the Battle of Borodino. While Tolstoy adds fictional characters and narratives, the settings themselves are based on real places and historical contexts. Given the standards and context of the time, the settings are firmly rooted in reality with no invented locations. Therefore, the appropriate score for the settings in ""War and Peace"" is:

Score=0",2,1,0
"The Iliad","Homer",-800,"Greece","The Iliad by Homer written in -800","The Iliad by Homer is an ancient Greek epic poem that features a mix of real and mythological elements. The main characters include figures like Achilles, Hector, and Agamemnon, who are based on legendary heroes and leaders from the Trojan War, a historical event that may have some basis in reality. However, the details of their lives, their interactions with gods, and their superhuman abilities are largely invented and mythologized. Given the standards and context of the time, these characters are best described as invented characters who could have existed, as they are based on legendary figures that were believed to have lived in a semi-mythical past. Score=2","The Iliad by Homer is an epic poem that recounts events during the Trojan War, a conflict between the city of Troy and the Greek states. While the existence of a city called Troy and a war involving it is supported by some archaeological evidence, the specific events and characters described in The Iliad, such as the involvement of gods and the detailed personal exploits of heroes like Achilles and Hector, are largely mythological and not supported by historical evidence. The narrative includes supernatural elements and divine interventions, which are characteristic of myth rather than history. Given the standards and context of the time, these elements were part of the storytelling tradition and not intended to be factual accounts. Therefore, the events in The Iliad are best categorized as invented historical events whose occurrence is improbable. Score=3","The Iliad by Homer is set in the context of the Trojan War, which is traditionally believed to have taken place in the region of what is now northwestern Turkey. The city of Troy, where much of the action occurs, is a real geographical location, although its exact historical details and the events described in the epic are subject to mythological embellishment. The settings in The Iliad include real geographical locations such as the Aegean Sea and the Greek mainland, but with invented details that enhance the narrative. Given the standards and context of the time, these settings are based on real places but are infused with mythological and fictional elements. Therefore, the appropriate score for The Iliad's settings is: Score=1.",2,3,NA
"The Lord of the Rings (series)","J.R.R. Tolkien",1954,"United Kingdom","The Lord of the Rings (series) by J.R.R. Tolkien written in 1954","The main characters in ""The Lord of the Rings"" series by J.R.R. Tolkien include hobbits, elves, dwarves, wizards, and other fantastical beings. These characters are entirely invented and are part of a fictional world with its own mythology and history. Given the context of the time when the series was written, these characters are not based on real people or historical figures, nor are they intended to be plausible within the real world. Instead, they are part of a high fantasy genre that embraces the creation of entirely new races and beings that could not have existed in reality. Therefore, the main characters fall into the category of ""Invented characters that could not have existed."" Score=4","The Lord of the Rings series by J.R.R. Tolkien is a high fantasy work set in the fictional world of Middle-earth. The events described in the series, such as the journey of the Fellowship, the battles against Sauron, and the existence of races like elves, dwarves, and hobbits, are entirely invented and take place in a world with its own geography, history, and mythology. These events are not based on actual historical occurrences and are set in a universe with its own set of rules and logic, distinct from our own reality. Given the context of the time and the nature of the work as a fantasy epic, the events described could not have occurred in the real world. Therefore, the appropriate evaluation for the events in The Lord of the Rings series is that they are invented historical events that could not have occurred. Score=4","The Lord of the Rings series by J.R.R. Tolkien is set in Middle-earth, a fully invented world with its own geography, history, and cultures. While Tolkien drew inspiration from real-world mythologies and landscapes, Middle-earth itself is a fictional creation. The level of detail and internal consistency in the world-building makes it feel immersive and believable within the context of the story. However, the existence of Middle-earth as a real geographical location is improbable, as it includes fantastical elements such as elves, dwarves, and magic. Therefore, based on the specified referent of settings, the work should be evaluated as having invented locations whose existence is improbable. Score=3",4,4,3
"Alice's Adventures in Wonderland","Lewis Carroll",1865,"United Kingdom","Alice's Adventures in Wonderland by Lewis Carroll written in 1865","Alice's Adventures in Wonderland by Lewis Carroll features a mix of characters, but the main characters are primarily invented and fantastical. Alice, the protagonist, is a young girl who could have existed, but the majority of the characters she encounters in Wonderland, such as the Cheshire Cat, the Mad Hatter, and the Queen of Hearts, are highly improbable in terms of existence. These characters are anthropomorphic animals and fantastical beings that defy the natural laws of the real world. Given the standards and context of the time, these characters are clearly products of imagination and fantasy, designed to entertain and provoke thought rather than reflect reality. Therefore, the main characters in this work are best categorized as invented characters whose existence is improbable. Score=3","Alice's Adventures in Wonderland by Lewis Carroll is a classic work of fantasy literature that features a series of whimsical and surreal events. The story follows a young girl named Alice as she falls down a rabbit hole into a fantastical world populated by peculiar creatures and characters. The events in the book, such as Alice growing and shrinking in size, talking animals, and the nonsensical court trial, are clearly products of imagination and fantasy. These events could not have occurred in reality, even considering the standards and context of the time when the book was written in 1865. Therefore, the events in Alice's Adventures in Wonderland are best categorized as invented historical events that could not have occurred. Score=4","Alice's Adventures in Wonderland by Lewis Carroll is set in a fantastical world that Alice enters through a rabbit hole. The setting includes whimsical and surreal elements such as talking animals, a disappearing cat, and a queen who orders beheadings at whim. These elements create a world that defies the laws of physics and logic as understood in the real world. The setting is not based on any real geographical locations and includes features that are highly improbable and fantastical, such as the Mad Hatter's tea party and the Queen of Hearts' croquet game with flamingos and hedgehogs. Given the context of the time, the setting is clearly intended to be a product of imagination and fantasy, making it a location that could not have existed in reality. Score=4",3,4,4
"The Hitchhiker's Guide to the Galaxy","Douglas Adams",1979,"United Kingdom","The Hitchhiker's Guide to the Galaxy by Douglas Adams written in 1979","""The Hitchhiker's Guide to the Galaxy"" by Douglas Adams is a science fiction novel that features a variety of characters, many of whom are highly improbable or fantastical. The main characters include Arthur Dent, an ordinary human, and Ford Prefect, an alien researcher for the titular guidebook. Other characters include Zaphod Beeblebrox, a two-headed, three-armed ex-President of the Galaxy, and Marvin, a depressed robot. Given the context of the time and the genre, these characters are clearly invented and their existence is improbable, especially considering the fantastical elements such as intergalactic travel, alien species, and advanced technology. Therefore, the main characters fall into the category of ""Invented characters whose existence is improbable."" Score=3","The Hitchhiker's Guide to the Galaxy by Douglas Adams is a science fiction novel that features a variety of imaginative and fantastical events. The story begins with the destruction of Earth by a Vogon constructor fleet to make way for a hyperspace bypass, which is an invented historical event. While the narrative is set in a universe that mirrors some aspects of our own, the events described, such as interstellar travel with improbably advanced technology and encounters with various alien species, are highly improbable given our current understanding of physics and space travel. The context of the time, the late 1970s, was marked by a burgeoning interest in space exploration and science fiction, but the events in the book remain firmly in the realm of speculative fiction. Therefore, the events in The Hitchhiker's Guide to the Galaxy are best categorized as invented historical events whose occurrence is improbable. Score=3","""The Hitchhiker's Guide to the Galaxy"" by Douglas Adams is a science fiction novel that features a variety of settings, many of which are entirely invented and fantastical. The story includes locations such as the planet Magrathea, the spaceship Heart of Gold, and the restaurant at the end of the universe. These settings are not only invented but also incorporate elements that defy the known laws of physics and reality, such as planets being constructed and a restaurant existing at the literal end of time. Given the imaginative and whimsical nature of these settings, they are locations that could not have existed in any realistic sense, even considering the standards and context of the time when the book was written. Therefore, the appropriate score for the settings in ""The Hitchhiker's Guide to the Galaxy"" is:

Score=4",3,3,4
"Animal Farm","George Orwell",1945,"United Kingdom","Animal Farm by George Orwell written in 1945","""Animal Farm"" by George Orwell is an allegorical novella that features anthropomorphized animals as its main characters. These characters, such as pigs, horses, and other farm animals, are used to represent figures and classes from the Russian Revolution and subsequent Soviet Union. While the animals are given human-like qualities and engage in complex social and political interactions, they are ultimately fictional and could not have existed in reality as they are portrayed in the story. The use of animals to symbolize human political figures and ideologies is a creative device that places the characters firmly in the realm of allegory and fiction. Therefore, based on the scale provided, the main characters in ""Animal Farm"" are best categorized as invented characters that could not have existed. Score=4","""Animal Farm"" by George Orwell is an allegorical novella that uses a farm and its animal inhabitants to represent the events leading up to the Russian Revolution of 1917 and the subsequent rise of the Soviet Union. The specific aspect to evaluate here is the events depicted in the story.

The events in ""Animal Farm"" are invented historical events that serve as an allegory for actual historical events. The story of the animals overthrowing their human farmer and establishing their own governance is a fictional narrative. However, it is a clear metaphor for the Russian Revolution and the rise of Stalinism, with characters and events paralleling real historical figures and occurrences. While the events on the farm did not literally happen, they are crafted to reflect and critique real historical events in a way that could have metaphorically occurred.

Given this context, the events in ""Animal Farm"" are best categorized as invented historical events that could have occurred in a metaphorical sense, but not literally. Therefore, the appropriate score is:

Score=2","""Animal Farm"" by George Orwell is an allegorical novella that uses a farm as its primary setting. The farm, known as ""Manor Farm"" and later ""Animal Farm,"" is a fictional location. However, it is depicted in a way that could plausibly exist in the real world. The setting is a typical English farm, which aligns with real geographical locations, but the specific farm itself is invented. Given the context of the time, the setting is meant to be a stand-in for any farm in England, making it a plausible invented location. Therefore, the setting of ""Animal Farm"" fits the category of invented locations that could have existed. Score=2",4,2,2
"The Pilgrim's Progress","John Bunyan",1678,"England","The Pilgrim's Progress by John Bunyan written in 1678","""The Pilgrim's Progress"" by John Bunyan is an allegorical work that features characters who are not intended to be realistic individuals but rather personifications of abstract concepts and moral qualities. The main character, Christian, along with others like Faithful, Hopeful, and Giant Despair, are invented characters that serve symbolic purposes within the narrative. Given the allegorical nature of the work, these characters are not meant to represent real people or even plausible individuals who could have existed in the real world. Instead, they are embodiments of spiritual and moral ideas, making their existence improbable in a literal sense. Therefore, based on the specified referent, the main characters in ""The Pilgrim's Progress"" would be classified as invented characters whose existence is improbable. Score=3","""The Pilgrim's Progress"" by John Bunyan is an allegorical work that depicts the journey of its protagonist, Christian, from the City of Destruction to the Celestial City. The narrative is a spiritual allegory rather than a historical account. The events described in the book, such as Christian's encounters with characters like Evangelist, Obstinate, and Pliable, as well as places like the Slough of Despond and Vanity Fair, are symbolic and represent spiritual and moral challenges rather than actual historical events. Given the allegorical nature of the work, the events are invented and could not have occurred in a literal historical context. Therefore, based on the specified referent of events, the work should be evaluated as depicting invented historical events that could not have occurred. Score=4","""The Pilgrim's Progress"" by John Bunyan is an allegorical work that features a journey through a series of invented locations, such as the Slough of Despond, Vanity Fair, and the Celestial City. These locations are symbolic and serve as metaphors for various spiritual and moral challenges faced by the protagonist, Christian, on his journey to salvation. The settings are not intended to represent real geographical locations, nor are they plausible as real-world places. Instead, they are crafted to convey Bunyan's religious and moral messages. Given the allegorical nature of the work and the symbolic purpose of its settings, these locations could not have existed in reality. Therefore, based on the specified referent, the score is: Score=4",3,4,4
"La Nouvelle Héloïse","Jean-Jacques Rousseau",1761,"France","La Nouvelle Héloïse by Jean-Jacques Rousseau written in 1761","""La Nouvelle Héloïse"" by Jean-Jacques Rousseau is an epistolary novel that features characters who are entirely fictional but are crafted with a level of realism that makes their existence plausible within the context of 18th-century European society. The main characters, such as Julie, Saint-Preux, and Claire, are invented but are depicted with detailed personalities, emotions, and social circumstances that reflect the norms and issues of Rousseau's time. They are not based on real historical figures, but their lives and experiences could have conceivably occurred in the period's social and cultural setting. Therefore, the characters fall into the category of invented characters who could have existed. Score=2","""La Nouvelle Héloïse"" by Jean-Jacques Rousseau is an epistolary novel that explores themes of love, morality, and society through the correspondence between its characters. The novel is set in a fictional context, with events and characters that are products of Rousseau's imagination. However, the social and cultural backdrop against which the story unfolds reflects the 18th-century European context, making the setting plausible for the time.

The specific aspect to evaluate here is the historical events depicted in the novel. The events in ""La Nouvelle Héloïse"" are not based on actual historical occurrences but are rather invented to serve the narrative and thematic purposes of the novel. These events are crafted in a way that they could have occurred within the societal norms and conditions of the 18th century, making them plausible within that context.

Therefore, the invented historical events in ""La Nouvelle Héloïse"" fall into the category of events that could have occurred, given the standards and context of the time. 

Score=2","""La Nouvelle Héloïse"" by Jean-Jacques Rousseau is set in real geographical locations, primarily in Switzerland, particularly around the Lake Geneva region. Rousseau, who was familiar with the area, used real places such as Vevey and Clarens, incorporating them into the narrative with a high degree of accuracy. While he may have added some fictional details to enhance the story, the settings are based on actual locations that existed at the time. Therefore, the work fits the category of real geographical locations with invented details. Score=1",2,2,1
"The Man in the High Castle","Philip K. Dick",1962,"United States","The Man in the High Castle by Philip K. Dick written in 1962","""The Man in the High Castle"" by Philip K. Dick is a work of alternate history, set in a world where the Axis powers won World War II. The main characters in the novel are fictional, but they are crafted to fit into this alternate historical context. They are not based on real historical figures, but they are designed to be plausible within the world that Dick has created. Given the standards and context of the time, these characters are invented but could have existed in the alternate reality presented in the novel. Therefore, they fall into the category of invented characters who could have existed. Score=2","""The Man in the High Castle"" by Philip K. Dick is an alternate history novel that explores a world in which the Axis powers won World War II. The specific referent here is the invented historical events of the Axis victory and the subsequent division of the United States between Nazi Germany and Imperial Japan. 

In the context of the time when the novel was written (1962), the idea of the Axis powers winning World War II was a speculative scenario. While the events are based on the real historical context of World War II, the outcome and subsequent geopolitical developments are entirely fictional. However, the scenario is constructed in a way that, while improbable, is not entirely outside the realm of possibility given the historical context and the uncertainties of war. 

Therefore, the invented historical events in the novel are improbable but not impossible, as they are based on a plausible alternate outcome of a real historical event. 

Score=3","""The Man in the High Castle"" by Philip K. Dick is set in an alternate history where the Axis powers won World War II, leading to a divided United States controlled by Nazi Germany and Imperial Japan. The geographical locations in the novel, such as the Pacific States of America and the Greater Nazi Reich, are based on real places but are reimagined to fit this alternate historical context. The settings are real geographical locations with significant invented details to reflect the alternate history scenario. Given the standards and context of the time, this approach aligns with a speculative reimagining of real places rather than creating entirely fictional worlds. Therefore, the appropriate score for the settings in this work is:

Score=1",2,3,1
